,title,subreddit
688,[Ardaya] Dave Roberts said Daniel Hudson injured his ACL. His season is likely over.,baseball
689,[Ardaya] Dave Roberts said Daniel Hudson injured his ACL. His season is likely over.,baseball
690,[Ardaya] Dave Roberts said Daniel Hudson injured his ACL. His season is likely over.,baseball
691,[Sox Notes] Nick Pivetta is 8-1 with a 1.85 ERA in his last 10 starts. Most recent Red Sox with 8+ wins and a sub-1.90 ERA over a span of 10 starts: Nick Pivetta Pedro Martinez Derek Lowe Tim Wakefield Roger Clemens Luis Tiant,baseball
692,Julio Rodriguez hits an absolute scorcher down the line to extend the M's lead to 3-0 in the 4th,baseball
693,[Cut4] wait for it,baseball
694,"Kyle Hendricks’ final line versus the Cardinals: 7.1 IP, 5 H, 0 ER, 1 BB, 6 SO, 91 total pitches",baseball
695,"Justin Verlander Final Line @ NY Yankees in the rain: 7.0 IP, 4 H, 1 ER, 1 BB, 3K, 102 Pitches. Improves to 9-3, tied for MLB Lead in Wins.",baseball
696,"[MLB Quality of Pitch] Astros Justin Verlander 2022 Pitch Quality, lowers ERA to 2.22",baseball
697,"In what is by far the biggest news story of the day, the Detroit Tigers have hit their first Grand Slam of the year.",baseball
698,"With tonight‘s lost to the Royals, the A’s are now 4-22 in their last 26 games",baseball
699,Javy Baez stays scorching with a grand slam against the DBacks,baseball
700,"[Highlight] Javier Baez hits a 459 ft, 111 MPH grand slam, chirping to fans on his way, for his third straight game with a HR!",baseball
701,Pleasantly surprised with first game on Bally Sports+,baseball
702,"German Marquez against the Twins: 7.2IP, 3H, 0R, 5BB, 2K",baseball
703,"Alejandro “Ted Williams” Kirk with his 4th hit of the game, a line drive HR over the LF wall",baseball
704,Alejandro Kirk homers for his 4th hit of the night. He's now hitting .321 with a .919 OPS,baseball
705,The Astros win 3-1 and snap a 15 game home winning streak by the Yankees,baseball
706,"Justin Verlander Final Line @ NY Yankees: 7.0 IP, 4 H, 1 ER, 1 BB, 3K. Improves to 9-3",baseball
707,Random MLB Charts'n graphs: Recent 3K Hits Leader-board by dates of passage,baseball
708,Ah… Low-A Minor League Baseball,baseball
709,[Highlight] Max Kepler with a Amazing Diving catch to prevent another run from being scored,baseball
710,"Apple, and every other broadcaster, please give us the option to watch the game without announcers.",baseball
711,Daniel Hudson injures himself on a Ronald Acuña Jr. infield hit and has to leave the game.,baseball
712,"Ian Happ his last 15 games: .358, .433, .585. 19 H, 2 HR, 7 RBI, 5 BB.",baseball
713,"[Plunkett] Daniel Hudson's left knee buckled as he tried to follow through on a pitch, pivot and chase a ground ball the other way. He was down in pain and has to be helped off the field",baseball
714,"Fans of bad teams, what keeps you watching?",baseball
715,Making a case for Robo umps,baseball
716,"WinZO - Play Carrom, Cricket, Rummy, Fantasy Sports &amp; 70+ Games on India's Largest Real Cash Gaming App - Win Cash Daily!",baseball
717,"[Stephen] In the Dodgers’ 69th game of the season, Julio Urías pitched 6 innings and struck out 9, and he retired 6 of his last 9 batters faced",baseball
718,Practice ball in play at Draft League game,baseball
719,"[Kramer] Cool moment just ahead of first pitch, with Mike Trout going out to introduce himself to Julio Rodríguez, who giddily gives him a big hug.",baseball
720,"Julio Urías Final Line vs the Braves: 6 IP, 3 H, 1 ER, 2 BB, 9 Ks, 94 pitches (season high)",baseball
721,Edward Olivares hits his second HR of the game to put the Royals up 2-1,baseball
722,Christian Arroyo hits a clutch two-run homer to give the Red Sox a late-game lead,baseball
723,"HOU@NYY: Giancarlo Stanton goes oppo into the second deck for the second straight game to put the Yankees on the board, 3-1 HOU",baseball
724,[Highlight] The 3-run homers continue in the Bronx with Kyle Tucker putting the Astros up 3-0 in the 6th,baseball
725,Cheat sheets ? Or ?,baseball
726,Blooper absolutely destroys the drill during the Home Depot Tool Race.,baseball
727,[Nightengale Jr] A good number of Reds pitchers wearing “Pham” shirts pregame in San Francisco today.,baseball
728,[Highlight] Outfielder Oscar Gonzalez makes the catch and throws out the runner at home to keep the game tied for a clutch double play,baseball
729,Why can't you review fair/foul calls if they don't happen past the first/third base umpires?,baseball
730,"Oscar Gonzalez makes a shoestring catch, then doubles up Arroyo at home",baseball
731,COME VIBE WITH A FIREE BBW😈 JOIN MY ONLYFANS MY INSTAGRAM IS SILISE2 OR CLICK LINK TO JOIN 🔥🔥😈😈,baseball
732,What would happen if a manager of an MLB team was not on the player roster but goes up to the plate to pinch hit?,baseball
733,"NYM@MIA: Willians Astudillo seemingly starts a double play, overturned after replay shows missed tag at 2nd base and Starling Marte reaching base first",baseball
734,Aaron Hicks lays out to rob Altuve of extra bases,baseball
735,Aaron Hicks lays out to rob of extra bases,baseball
736,[Codify] Shohei Ohtani has a June slugging percentage of .699 during his MLB career and that's higher than anyone with at least 120 June plate appearances in the last 80 years.,baseball
737,"Verlander has clearly been ""juicing"" players don't get better with age after 35. Justin must have bonds and Armstrongs Dr",baseball
738,Raffy Devers golfs his 17th homer of the season to give the Red Sox the lead,baseball
739,George Springer's dad is a Denzel Washington doppelganger,baseball
740,Runner on third breaks for home before the pitcher begins his windup. Is the batter allowed to swing at the ball or does he have to back out of the box?,baseball
741,Freddie Freeman about to get one of the loudest standing ovations in baseball history.,baseball
742,[Highlight] Acuña is caught stealing after he slides off the bag,baseball
743,[highlight] Will Smith throws out acuña at second base,baseball
744,Dansby Swanson loses his bat and Max Muncy attempts to field it.,baseball
745,[highlight] acuña and freeman hug it out,baseball
746,"[Kramer] Ty France and the Mariners are still awaiting the results of the MRI he underwent earlier today. They’re consulting multiple doctors. France is still stiff and sore, but he said in the clubhouse that he’s feeling better.",baseball
747,Foul ball to the right...extra innings with a man on 3 and 1 out...don't you let that go foul despite you right fielder having a read on it?,baseball
748,[Highlight] Another Trea Turner cool slide (ft. almost getting hit in the head),baseball
749,"[Highlight] Will Smith with an RBI double, Trea Turner with another buttery smooth slide",baseball
750,"[PlayoffTanaka] Aaron Hicks’ magical home run, in Moneyball form",baseball
751,[Highlight] Freddie Freeman receives an incredible standing ovation before his first plate appearance back at Truist Park followed by a chorus of boos.,baseball
752,Full highlight video of Freddie Freeman's World Series ring presentation and speech (6 minutes).,baseball
753,[Ben Verlander] There is no “Buster Posey Rule” in the Mexican Baseball League. So here’s a video of Pablo Sandoval absolutely trucking a catcher at home plate.,baseball
754,[Highlight] Braves tribute to Freddie Freeman,baseball
755,Do you think MLB players should wear pride jerseys every day in June?,baseball
756,Pablo Sandoval has a play at the plate,baseball
757,I found this old signed ball I got at baseball game when I was younger. I was hoping to find someone in this subreddit who can identify the name,baseball
758,JOSE RAMIREZ WEARING A SHIRT OF HIMSELF WEARING A SHIRT OF HIMSELF,baseball
759,Is it legal for a pitcher to throw the ball behind his back,baseball
760,[Chicago Cubs] The #Cubs today reinstated INF David Bote from the 60-day IL. INF Jonathan Villar was designated for assignment.,baseball
761,"Casual fan here, but have been following Shohei because he seems like he's on a historic path and just an awesome dude, but is he under the radar being out in LA?",baseball
762,[Healey] Buck Showalter said Max Scherzer might make another minor-league start Sunday. The St. Lucie Mets are facing @GoPBCardinals that day...,baseball
763,Has anyone dealt with StubHub not being be able provide the tickets you purchased and then offered you a downgrade section? What happened on their end and what options do I have?,baseball
764,Park Names,baseball
765,Why is Jorge López so good this year?,baseball
766,[Puma] Jacob deGrom is scheduled to throw live batting practice Saturday in Miami. It will be his second live BP.,baseball
767,Prized Yankees prospect getting hot at the plate,baseball
768,online weight loss programs: how are you losing weight?,baseball
769,SEIYA SUZUKI PSA GEM 10 POP 1/1 2019 BBM GENESIS MEMORABILIA #8/20 Chicago Cubs,baseball
770,Patrick Mooney on Twitter - Cubs DFA Jonathan Villar. Activate David Bote,baseball
771,[Martin] Freddie Freeman was asked if he thought this day was going to be this emotional. Just listen:,baseball
772,"[Ardaya] Dustin May faced hitters today in an up-down in Arizona, Dave Roberts said. Sat 98-101 mph, according to the reports he got. If all goes well, May’s four live BPs would time out for him starting a rehab assignment around mid-July",baseball
773,What happened to the pro-player stance on here?,baseball
774,[Ardaya] Dave Roberts said an MRI revealed a left shoulder strain for Andrew Heaney. Will miss at least a couple starts.,baseball
775,St. Louis Cardinals of the Metro East ?,baseball
776,Al Capone with his party at the charity game between the White Sox and Cubs in Chicago in 1931. The Cubs player is Gabby Hartnett.,baseball
777,"[MLBTRADERUMORS] Dodgers 1B Freddie Freeman has been scratched from today's start because it's ""just too emotional.""",baseball
778,"[Ardaya] Freddie Freeman: “I have no regrets and I’m not looking for closure. There’s nothing to close for me here. Why would I close it? It’s such a special time, the 15 years I spent here.”",baseball
779,GETRESPONDENCE: Powerful and simplified tool to send emails,baseball
780,"[Ardaya] Freddie Freeman walked up to the podium in the Braves interview room, teared up with his hands on his head, and left.",baseball
781,[Toribio] Freddie Freeman walked into the interview room at Truist Park and immediately started crying. He asked the media to give him a few minutes.,baseball
782,Baseball players and the first video you think of when you hear their name,baseball
783,[LAD] The Dodgers recalled RHP Reyes Moronta from Triple-A Oklahoma City and placed LHP Andrew Heaney on the injured list with left shoulder inflammation.,baseball
784,Babe Ruth paying his respects to Lou,baseball
785,Brandon Woodruff Slays MiLB,baseball
786,"New to baseball, can pros that use wilson and nike (anything not rawlings) still win a gold glove?",baseball
787,NPB phenom Rōki Sasaki now has a lower WHIP than anyone with as many innings pitched in NPB history since 1967. Here is a table comparing his season so far to some of the best in NPB history.,baseball
788,What should r/baseball do for reaching 2 million members?,baseball
789,NEED MORE YANKEES!!!,baseball
790,"New to baseball, can pros that use wilson and nike (anything not rawlings) still win a gold glove?",baseball
791,Al Capone with his party at the charity game between the White Sox and Cubs in Chicago in 1931. Gabby Hartnett of the Cubs is shown autographing a ball for Capone's son Al (Sonny) Jr. Note the scars on Capone's face.,baseball
792,"The last time a team used all 25 players on the roster in a single game was the Cubs on August 15th, 2006",baseball
793,"Despite having three divisional opponents and a designated interleague rival in the same time zone, the Giants have played fewer road games in the Pacific Time Zone than any other time zone.",baseball
794,Dwarka Sector 23B DDA Flats,baseball
795,Builder Flats in Dwarka,baseball
796,In 2001 Angel Berroa would win AL Rookie of the Year and post 2.5 WAR. He would finish his career 6 years later with 1 career WAR.,baseball
797,Trea Turner Triple feat. a smooth slide but the video cuts out too soon,baseball
798,Blockchain Games | Planet IX Crypto | Planet IX,baseball
799,Question about all the plus stats,baseball
800,"[Sherman] How much was the Judge negotiation a game of chicken: The participants were in their rooms and the arbitrators were on the Zoom call, when there was a request to delay the noon start to see if they could finalize an agreement to avoid the arbitration hearing -- which they did.",baseball
801,[Orioles Fan Problems] 2018 Orioles: 32-75; 2019; Orioles: 32-69; 2021 Orioles: 32-64; 2022 Orioles: 32-39,baseball
802,[Heyman] Toronto coach Guillermo Martinez gets 5-game suspension for Wednesday’s pregame conduct toward umpiring crew in Chicago.,baseball
803,"[Nightengale] Toronto #BlueJays hitting coach Guillermo Martinez is suspended for five games and fined for making contact with home-plate umpire Doug Eddings and ""unsportsmanlike conduct'' delivering the lineup card before their game Wednesday against the #WhiteSox",baseball
804,[Rogers] Toronto Blue Jays hitting coach Guillermo Martinez has received a five-game suspension and fine for making contact with umpire Doug Eddings during the pregame lineup card exchange prior to Wednesday’s game against the White Sox.,baseball
805,[Cardinals] LHP Packy Naughton has been recalled from Memphis (AAA).,baseball
806,Come on ESPN did he sign it or not?,baseball
807,I cannot wait for the RotoUmp,baseball
808,"If the Angels hire a new manager, here's their guy (Darin Erstad)",baseball
809,The New York Yankees could very well have the best franchise lineup since 1996.6,baseball
810,"[Feinsand] Judge can earn $250,000 for 1st place MVP and $250,000 for World Series MVP.",baseball
811,"[Feinsand] Judge can earn $250,000 for 1st place MVP and $250,000 for World Series MVP.",baseball
812,Thank you for this community,baseball
813,"[Feinsand] In a surprising development, Aaron Judge and the Yankees agreed to a $19 million deal (plus incentives) for 2022 to avoid arbitration, per source. @JonHeyman was first to report a deal had been made.",baseball
814,Kansas City Royals on Twitter: Salvador Perez will have surgery to repair the ulnar collateral ligament on his left thumb. He has been placed on the 10-day injured list and is expected to return this season.,baseball
815,[Alec Lewis] Salvador Perez will have surgery on his left thumb. He’s expected to return this season.,baseball
816,[Heyman] Sources: Judge and the Yankees have settled,baseball
817,[Heyman] Sources: Judge and the Yankees have settled,baseball
818,[Heyman] Judge and the Yankees have settled,baseball
819,Adrelton Simmons' walk off triple 7/29/13,baseball
820,How long can a fielder hold onto the ball with the pitcher off the mound?,baseball
821,Sources: Judge declines $19M offer from Yanks,baseball
822,OFFICIAL FRIDAY COMPLIMENT THREAD,baseball
823,Favorite Broadcast View? Would love to see all the parks use this one.,baseball
824,"Which team has been the hardest hit by injuries this season? Also, historically which team and season was most affected by injuries?",baseball
825,Umpire ScoreCards for Yankees VS Astros last night,baseball
826,[UmpScorecards] MLB Umpire Scorecards for 6/23/2022,baseball
827,Astros @ Yankees Ump Scorecard 6/23/22,baseball
828,"Should we start give O'Neill Cruz ""Shaq"" as nickname?",baseball
829,Hi hit me up guys 😊,baseball
830,TBH I don't follow much of baseball these days but I'm always interested in unique rules (like a bounce into the stands = run to second base) - any others y'all know about?,baseball
831,Black or white White Sox jersey?,baseball
832,"Top 5 Plays by Win Probability Added - June 23, 2022",baseball
833,Orix Buffaloes OF Masataka Yoshida hits an absolute moonshot that ends up on ZOZO Marine Stadium's roof,baseball
834,Aaron Judge &amp; Paul Goldschmidt are the new leaders of the latest MLB.com MVP poll,baseball
835,If a game went 20 innings…,baseball
836,Current All Star Predictions,baseball
837,Authentic Jersey Tags?,baseball
838,Do walkoff hits hurt your stats?,baseball
839,Why is there seemingly always so many top 100 Catcher prospects?,baseball
840,"[Rome] Asked if he considered just putting Aaron Judge on after it got to 3-0, Dusty Baker replied: “If I’d have done that and the next guy gets a hit, you’d be second-guessing me like Tony La Russa.”",baseball
841,"6/23 Highlight Roundup: FastCast, top plays, recaps/condensed games and longest dongs of the day",baseball
842,Nightly Pick 'em Game for June 24th,baseball
843,[General Discussion] Around the Horn - 6/24/22,baseball
844,Thank you u/ohbarryoh for “the poll” during the lockout.,baseball
845,"Hotaka Yamakawa takes Masahiro Tanaka deep for his 22nd homer of the season, and the 200th of his career",baseball
846,[NPB] 20 year old pitching phenom Roki Sasaki looking at Tayron Guerrero with disgust after spitting on the field.,baseball
847,American marionette Dorik Aisha,baseball
848,I need help trying to remember what this baseball movie was called.,baseball
849,Please subscribe to the YouTube channel below our formal YouTube account as been hacked.👇👇👇👇👇👇👇👇 https://www.youtube.com/channel/UC0L84vBWCwvSm-p3zMYxeMg?sub_confirmation=1 THANKS.,baseball
850,Someone Wrote Their Headline a Little Prematurely,baseball
851,What’s up with the behind the scenes for the cubs lately?,baseball
852,"TIL Musician Jack White co-owns a baseball bat company called Warstic. Miggy, Nick Castellanos, Justin Upton, and other pros are sponsored by them.",baseball
853,classic baseball,baseball
854,"[Ruiz] With the help of Félix Bautista, Dean Kremer has joined John Means and Matt Harvey as the only Orioles in Brandon Hyde's tenure with consecutive scoreless starts of at least five innings.",baseball
855,The Orioles great defensive night in the outfield,baseball
856,Brutal list of names currently injured for the White Sox.,baseball
857,[Nick Piccone] Joe Musgrove's 80th pitch vs. the Phillies.,baseball
858,Greg Maddux hit spots like no one could,baseball
859,Austin Hays made an outstanding catch in the 8th inning,baseball
860,Austin Hays made an incredible catch during the bottom of the 8th tonight,baseball
861,"Found this Todd Walker coin at a yard sale, anyone know anything about it?",baseball
862,Who is the player that signed this baseball? 1950’s maybe 60’s,baseball
863,What is the ruling if a batter standing on a base were struck by a ball and the ball was then deflected and caught without ever touching the ground (and without interference),baseball
864,[Phillies Nation] Third base umpire blows foul ball call and gifts Austin Nola a double. Call cannot be renewed.,baseball
865,Upper deck HRs old Yankee stadium,baseball
866,Upper deck HRs old Yankee stadium,baseball
867,Post Tommy John numbness,baseball
868,The Baltimore Orioles have given up 4 runs in the last 36 Innings and 3 Shutouts in last 6 games,baseball
869,"With the Brewers' win today, every division has a team with 40+ except the AL Central.",baseball
870,Franchises fear them,baseball
871,Veteran pitcher Cole Hamels is looking for MLB comeback,baseball
872,J. T. Realmuto pokes a 3-run oppo taco off the top of the fence to break it open against the Padres,baseball
873,[Fox Sports MLB] Jose Altuve signing autographs for Yankees fans,baseball
874,"Kyle Schwarber gives the Phillies a 3-1 lead with his 20th home run of the year, 9th in June",baseball
875,https://youtu.be/0V_wZ446KA8,baseball
876,[Langs] “it’s like they have 3 Deion Sanders in the NFL out there” @jasonbenetti on the Orioles’ sparkling outfield defense tonight,baseball
877,"(Passan) On the night before Aaron Judge and the New York Yankees are scheduled to face off in an arbitration case and argue over whether he’s worth $21M or $17M, he delivers a walk-off single in a rousing comeback against Houston. (He’s worth a lot more than both numbers, by the way.)",baseball
878,"Players with 1,000 Hits in One Ballpark",baseball
879,Austin Hays with an incredible catch down the LF line,baseball
880,"Would you rather have your biggest rival win the World Series, or get Mad Cow Disease?",baseball
881,"Current AL Standings (06/23/22): ""Ladies and Gentlemen, the Bronx is Burning!!!""",baseball
882,[Stark] The Astros threw 39 pitches in that 9th inning. There was a 3-pitch strikeout of Joey Gallo in there. They didn’t retire a single Yankees hitter with any of the other 36 pitches.,baseball
883,A fan has run onto the field at Petco Park,baseball
884,"Aaron Hicks saying ""damn"" after tying the game in the ninth.",baseball
885,New York Yankees' record at home since a May 23rd loss to the Baltimore Orioles: 15-0,baseball
886,Why is Steve Cohen allowed to own a baseball team? (Serious),baseball
887,Baseball at the 2022 Pacific Mini Games: Gold and Bronze Medal Games (Tonight/Tomorrow),baseball
888,"[The Onion] Fucking Yankees, Reports Nation",baseball
889,"Aaron Judge Drives Home Winning Run. Yankees Come Back, Win 7-6.",baseball
890,[Highlight] Aaron Judge comes up with a huge single in the bottom of the 9th to give the Yankees their 9th walkoff victory of the year after a four-run rally,baseball
891,"[MiLB Hatbilly] Sammy Stewart - Baseball's Most Arrested Player, '83 World Series Champion",baseball
892,IKF gets caught stealing in a tie game in the 9th on a close play. Stands upon review,baseball
893,Is there a requirement to post in team subreddits?,baseball
894,AARON HICKS WITH A 3 RUN BOMB TO TIE THE GAME AT 6,baseball
895,This Yankees Comeback Voodoo…,baseball
896,[Highlight] Aaron Hicks ties the game with a three-run shot in the bottom of the 9th. All 12 runs between the Astros and Yankees have been scored on three-run home runs.,baseball
897,"Can baseball games look closer in score than they actually were like in other sports? Situations were the ""score was closer than the game""?",baseball
898,"As the Phillies announcers discuss Hosmer's recent struggles, Hosmer crushes a solo homer to right to make it 1-0 Padres",baseball
899,Can baseball games look closer in score than they actually were like in other sports? With misleading scores?,baseball
900,How to look up specific game scenarios for minor league games?,baseball
901,Would you rather have Justin Verlander for their entire career or Steven Strasburg?,baseball
902,[Highlight] Kyle Tucker robs Anthony Rizzo with a fantastic leaping catch in deep right field,baseball
903,"Does anyone know whose signature this is? Probably around 1990s-early 2000’s, sorry if this is the wrong sub for this, but thank you.",baseball
904,What bothers you most about your fan base?,baseball
905,Im trying to watch this in California....,baseball
906,Largest run differential this season home v road via WhiteSox broadcast,baseball
907,"After 69 games played, the Pirates current winning percentage is .420",baseball
908,"After starting the game giving up 2 walks, 2 hits and 3 runs in the 1st inning, Framber Valdez ends up pitching his 11th straight quality start",baseball
909,Adley tees off to make it 2-0 Orioles,baseball
910,Just ate the Bryce Harper meal at Dairy Queen. Ask me anything.,baseball
911,[Baseball Memes] The greatest power hitter in baseball history posing for a photo with Aaron Judge.,baseball
912,they will start sponsoring at-bats,baseball
913,[Mackey] Source close to Ke’Bryan Hayes describes the Pirates third baseman as “all good” and “just a bit sore.” Will see how he feels in the morning.,baseball
914,does anyone know what this is worth ? I clean houses out foreclosed houses and this was in the closet. help!,baseball
915,Michael Kay asks Carlos Beltran live on air if he considers the Astros' World Series tainted.,baseball
916,MLB on FOX's scouting report on Philip Humber the day he threw a perfect game,baseball
917,Got my ohtani jersey in today,baseball
918,Nothing says America like the Blue Jays,baseball
919,"[Dallas Morning News] Rangers prospect Bayron Lora is on MLB’s restricted list, is not playing in minors",baseball
920,[Highlight] Yordan Alvarez snipes out a three-run shot to right for a prime porch job. This is already the third three-run home run of Game 1 between the Astros and Yankees.,baseball
921,"Cherry-picked stat: since 2021, Shohei Ohtani has the most games with 8 total bases and 3RBI in a team loss. It has happened three times.",baseball
922,[Highlight] Joey Gallo makes a sensational catch over the wall down the right field foul line,baseball
923,[SportStorm] Justin Verlander Defies All Logic,baseball
924,[Would it dong?] Giancarlo Stanton vs Framber Valdez Home Run Exit velo: 108 mph Launch angle: 34 deg Proj. distance: 383 ft No doubt about that one That’s a dinger in all 30 MLB ballparks,baseball
925,No team has ever had 3 runners in scoring position.,baseball
926,[Highlight] Giancarlo Stanton crushes an opposite field three-run bomb to the second deck to quickly tie the game back up in the first,baseball
927,"Shohei Ohtani since moving to pitch-com: 3-0, 0.43 ERA, 21 IP, 9 H, 25K",baseball
928,[Highlight] Bregman with an early 3-run bomb to make it 3-0 Astros,baseball
929,"[Highlight] Jameson Taillon lets the second pitch of the game get away and it clips Jose Altuve on the elbow, drawing a loud cheer from the hometown Yankee fans",baseball
930,Altuve gets plunked as Yankee fans admire with cheering,baseball
931,[Jake] Altuve hit first batter of the game. It’s going to be a long weekend.,baseball
932,2022 Dream Team,baseball
933,"The Domino Effect of Baseball, a breakdown",baseball
934,"[Drayer] Servais “cautiously optimistic” but also pointing out they are not out of the woods yet with France. X-rays negative, will have the elbow MRI’d tomorrow.",baseball
935,Tyrone Taylor pops it up for a 3 run shot,baseball
