,title,subreddit
447,"JT Realmuto seems to have found his power stroke again, this time crushing a solo homer off Blake Snell to make it 1-0 Phillies",baseball
448,Shohei Ohtani-San Hits 16th Shot of the Season,baseball
449,[SoxNotes] The Red Sox are 41-31. Only two American League teams have ever had that exact record through 72 games and gone on to win the World Series: 1918 Red Sox 2004 Red Sox,baseball
450,"[Ardaya] Freddie Freeman on getting booed in his bases-loaded at-bat in the seventh: ""I'm on a visiting team. You expect it. I'm not going to get cheers for six years.""",baseball
451,Byron Buxton Snaps the Twig after a Big Whiff,baseball
452,[highlight] the abominable snowman seems to be Chilling on the rocks while watching the angels game,baseball
453,Justin Upton breaks his bat over his leg after striking out with the bases loaded,baseball
454,"Bryce Harper gets hit in the hand, and is taken out of the game immediately",baseball
455,"[Zolecki] Bryce Harper just got hit with a 97.2 mph fastball. He is leaving the game, but not before saying something to Blake Snell.",baseball
456,Jason Varitek’s yearbook photo from his sophomore year of high school,baseball
457,[Toscano] Ronald Acuña fouled a ball off his foot. Brian Snitker didn’t think it was bad enough to be a fracture. Acuña is being evaluated.,baseball
458,JP Crawford loses his cool after a questionable strike three call robs him of a bases-loaded walk,baseball
459,[Fletcher] Patrick Sandoval got this call on a 3-2 pitch with 2 outs and the bases loaded in the 2nd.,baseball
460,Jeff Fletcher on Twitter: Patrick Sandoval got this call on a 3-2 pitch with 2 outs and the bases loaded in the 2nd.,baseball
461,FIREE BBW JOIN MY ONLYFANS 🔥 I SQUIRT TO DADDY💦💦 MY INSTAGRAM IS SILISE2 FOR LINK TO JOIN OR CLICK LINK,baseball
462,Kenley Jansen hit 98mph for the first time since 2016 tonight. Previous high since 2017 started was 97.5(6/07/17),baseball
463,Home plate Umpire confidently calls Bellinger out on a ball,baseball
464,Marcell Ozuna jacks up a 2-run homer to put the Braves up 5-3 in the bottom of the 8th,baseball
465,"If Jose Altuve retired tomorrow, Is he in the hall of fame?",baseball
466,Julio Rodriguez crushes a solo shot off of Patrick Sandoval to put the M's on top in the first!,baseball
467,"Will Smith Gets His Name Into The Scoring Column, Ties Game With Solo Shot",baseball
468,Can we just take a moment to recognize how much better baseball Reddit is than baseball Twitter?,baseball
469,Francisco Lindor knocks sends the ball down the line and slides around Jazz Chisolm's tag for a double,baseball
470,"[Rome] Cristian Javier is a $10,000 international signee that earned a nickname for his absolute absence of emotion. On Saturday, he bullied one of baseball's best lineups and out-dueled a $324 million ace, spearheading history",baseball
471,Ole Miss hits back-to-back-to-back home runs in the 8th inning,baseball
472,What are your “tin foil hat” conspiracy theories about the MLB?,baseball
473,[FOXSports:MLB] Cody Bellinger's reaction after that ball barely went foul,baseball
474,Bobby Witt Jr. snags a grounder in the gap and makes the leaping throw to record the out.,baseball
475,Bobby Witt Jr. gets the out at 1B from shallow left field with leaping throw,baseball
476,"Eck, Albert Belle, Reggie and Sandy Alomar Jr from Spring Training 1991",baseball
477,Visited the great Rube Waddell’s grave in San Antonio. Note the toy fire truck that someone had left for him.,baseball
478,Visited tge great Rube Waddell’s resting place in San Antonio this week. Note The toy fire truck that someone had left for him.,baseball
479,The All-Liquor Baseball Team,baseball
480,Rube Waddell,baseball
481,[Astros] Houston vs. all y'all. Still.,baseball
482,"After starting 10-19, the Red Sox have gone 31-12 since and currently have a 41-31 record, move to 2nd in the AL East and currently hold the Top Wild Card spot in the AL",baseball
483,[Sox Notes] The Red Sox: - Are in 2nd place in the AL East. - Are a season-high 10 games above .500. - Own MLB’s longest active win streak (6). - Are 18-4 (.818) in June. - Are 31-12 (.721) since May 10. - Have won 7 consecutive series. - Are 11-1-2 in their last 14 series.,baseball
484,"[Gleeman] Chris Archer, who threw a total of just 19 innings the previous two seasons and hasn’t had an ERA under 4.00 since 2015, now has a 3.14 ERA through 14 starts for the #MNTwins . Helluva reclamation project.",baseball
485,Francisco Alvarez #17 (@MLBPipeline),baseball
486,#17 for Francisco Alvarez,baseball
487,NY METS Consecutive Games Played Without an Injury,baseball
488,Hanser Alberto loses his bat and helmet on the same AB.,baseball
489,"Replay Officials give Pederson a Single, not a Double, when overturning a bad foul call, costing the Giants a run in the 1st inning.",baseball
490,The Boston Red Sox have committed a NOBLETIGER in the top of the 8th,baseball
491,Boston Red Sox with a NOBLETIGER.,baseball
492,Things I wish I never saw:,baseball
493,Rights,baseball
494,"If the MLB season were to end now, who do you all think should deserve the regular season MVP in both AL and NL leagues?",baseball
495,[SNY] The guys tried to rip off Buck's jacket,baseball
496,Dansby Swanson crushes a 2 run bomb to put the Braves up 2-0,baseball
497,"On 6/23 the Mariners scored their only 2 runs on back-to-back passed balls in the 9th inning, and won. When is the last time anything like that happened?",baseball
498,Do you think we should pride month,baseball
499,Have any teams or players reacted to Roe?,baseball
500,[Highlight] Tim Elko hits a solo shot to put the Rebels up 4 in the top of the 3rd,baseball
501,What are some players that are non deserving World Series champs?,baseball
502,These shifts are getting out of control,baseball
503,"Alex Verdugo crushes a go-ahead, three-run bomb off Bieber",baseball
504,"[NYMStats] The Mets have clinched a winning record in the month of June for the first time since 2012, when they went 15-13.",baseball
505,Byron Buxton hits an RBI triple in his first AB of the game,baseball
506,opinions on jerseys with gradients?,baseball
507,"The NY Mets have currently won 5/6 this year from the Marlins, and are looking for the series sweep tomorrow.",baseball
508,Half of NFL players play Madden Football to prepare for Sunday and studies have shown that players who play Madden Football understand football players much better than players who do not. Do any MLB pitchers and catchers play baseball video games as a simulator device to prepare against hitters?,baseball
509,If you don’t mind can you be my Sugar baby and I provide your needs and give you $500 weekly allowance?,baseball
510,[Michael Baron] Edwin Díaz just threw a fastball 103 mph.,baseball
511,"[Kremnitzer] If the Orioles (13-9 in June) win 1 of their next 5 games, they will claim their first full winning month since August 2017. It's been almost 5 years!!!!",baseball
512,Rays win!,baseball
513,straight men wanted,baseball
514,"Greetings from Europe, Ukraine. Glad to share some of my paintings with the Baseball Community!💛",baseball
515,"Corbin Burnes final line vs Toronto: 8 IP, 5 H, 3 R, 2 BB, 9 SO",baseball
516,Adolis Garcia crushes a walk off home run to give the Rangers a 3-2 win over the Nationals,baseball
517,Adolis Garcia walks off the Nationals with a solo homer in the 9th!,baseball
518,"[scottmerkin] La Russa: ""The problem is whenever we’ve pitched well, they’ve pitched better. Whenever we hit, they’ve hit better. You get outplayed, you lose games.""",baseball
519,Nice Snag By Yankees AA Catcher Josh Breaux Catching Aroldis Chapman in a Rehab Stint,baseball
520,[Highlight] Pete Alonso hits a frozen rope over the fence to take the lead in the 8th,baseball
521,[NYM@MIA]: Pete Alonso crushes a go-ahead laser beam solo home run for his second home run of the day to put the Mets up in the top of the 8th,baseball
522,Nelson Cruz just hit a ball down the line that was deflected by Josh Smith.,baseball
523,NYM@MIA: Pete Alonso hits a piss missile for his 2nd home run of the game,baseball
524,Austin Nola's RBI single against his brother Aaron to give the Padres the go ahead run.,baseball
525,"[@AJCassavell] Manny Machado is on the field, putting on his batting gloves, bat in hand, evidently about to take BP.",baseball
526,"With the Orioles victory today, they have now gained 2 games on the Yankees In the past 2 days",baseball
527,Discussion: What happened to Christian Yelich?,baseball
528,"[JRFegan] White Sox lose to the Orioles, 6-2 Their fourth-straight loss sees a would-be Lance Lynn gem hit the rocks in the seventh. The Sox offense has scored three runs in three games against Baltimore, and hasn’t homered since Monday. It’s rough out here. Sox are 33-37",baseball
529,Rangers apparently have a fry tossing game when they play at home,baseball
530,Tony Kemp does some crazy Tony Kemp shit in the alley to save couple of runs,baseball
531,Some stats from today's Houston no hitter+a statement from owner Jim Crane,baseball
532,"(MLB) Today the Houston Astros threw an combined No-Hitter against the New York Yankees. The last time the Yankees were victims of a no-hitter was on June 11th, 2003.... coincidentally, against the Houston Astros.",baseball
533,"[MLB Fox Sports] Josh Donaldson is MAD at the Astros Pitchers after being no hit, threatening to “Go to the Commissioner” about foreign substances he claimed the Astros used.",baseball
534,"[FOX Sports MLB] Beau Dowling, a 7-year-old recently diagnosed with thyroid cancer, got to participate in ""Home Run For Life"" and run the bases with the White Sox &amp; Orioles cheering him on",baseball
535,Position Player Pitching fans only,baseball
536,is there ANYONE in devers' ear to stop dipping?,baseball
537,Austin Hays blows the game wide open with a 2 out 3 run double to give the Orioles a 6-1 lead in the 7th,baseball
538,Austin Hays blows the game wide open with a 2 out 3 run double in the 7th,baseball
539,"Yusei Kikuchi pitching today: 2.0 IP, 2 ER, 5 R, 2 HR, 6 H, 1 BB, 5 SO, 69 pitches",baseball
540,Brosseau connects in his first game back from the IL to give the Brewers a 5-0 lead,baseball
541,[kubatko] Mancini is leaving the game after getting hit on the hand. Was his left hand this time,baseball
542,"[Szymborski] Baseball can always stand to be more popular, so I gave the neural network a bunch of real-life MLB promotions and instructed it to make me some dumb ones. Which one will get *you* headed straight to the park?",baseball
543,"The Astros have pitch their 3rd Combined No-Hitter, Which is the most is MLB history",baseball
544,"[Braves] OF Eddie Rosario is set to begin a major league rehabilitation assignment tonight with Triple-A Gwinnett in Nashville, Tenn.",baseball
545,[Bowman] Ian Anderson’s rough first inning was influenced by the difficulty to re-focus after Freeman’s standing ovation,baseball
546,Known power threat Rafael Ortega ties the ballgame with a 2 run blast in the 8th,baseball
547,[Langs] Highest winning percentage entering a game where that team was no-hit (min 50 games into season): Today Yankees: .732; 6/11/1990 A's: .691; 7/25/1883 Cleveland Blues: .691; 9/11/1882 Reds: .689,baseball
548,Altuve and his son.,baseball
549,"[Berman] Roy Oswalt,part of the @astros 6-pitcher combined no-hitter at Yankee Stadium in 2003,on the #Astros 3-pitcher combined no-hitter,in a text: “Congratulations! And tell them that (George)Steinbrenner sent us over champagne!Don’t let them get robbed (with) some 10 dollar champagne”",baseball
550,"lineups + pitching lines from the last time the Yankees were no-hit: June 11, 2003",baseball
551,Cristian Javier throws seven hitless innings with 13 K's,baseball
552,"lineups + pitching lines from the last time the Yankees were no-hit: June 11, 2003",baseball
553,Those damn trashcans,baseball
554,"[Rome] Cristian Javier, Héctor Neris and Ryan Pressly have combined to no-hit the New York Yankees at Yankee Stadium in a 3-0 win. It is the first no-hitter in the history of the new ballpark and the first against the Yankees since six Astros pitchers combined for one on June 11, 2003.",baseball
555,"[Ardaya] Daniel Hudson said he’s planning on giving it another go next season once he rehabs from a torn ACL. Surgery is likely, he said. But said he doesn’t want last night to be the last memory he has on a baseball field.",baseball
556,"Kikuchi appears to drill McCutchen who falls to the ground, until a horizontal Cutch laughs as he tells the umpire, ""It hit my bat!"" ... behind his back!",baseball
557,"Kikuchi appears to drill McCutchen who falls to the ground, until a horizontal Cutch laughs as he tells the umpire, ""It hit my bat!""",baseball
558,[Dubose] The New York Yankees have been no-hit twice since 1958. Both by the Houston Astros. Both at Yankee Stadium.,baseball
559,NYM@MIA: Pete Alonso goes opposite field for his 21st home run of the season,baseball
560,Yankees: Not what you want II (too early to panic?),baseball
561,[Gabe] The last 3 Yankee teams to be no-hit ended up going to the World Series.,baseball
562,Astros no-hit the Yankees at Yankee Stadium,baseball
563,The Yankees have been no hit.,baseball
564,"[Highlight] The New York Yankees are no-hit for the first time since 2003 as Cristian Javier, Hector Neris and Ryan Pressly of the Houston Astros combine to mow down the best offense in baseball",baseball
565,"Down to the final strike with the bases loaded, Isaac Paredes hits a walk off single to right field!",baseball
566,The Houston Astros have thrown a combined no-hitter vs. the Yankees!,baseball
567,"The Houston Astros have combined to pitch a no-hitter against the New York Yankees! Javier-Neris-Pressly Combined 9IP, 0H, 3 BB, 15K, 0R",baseball
568,The Astros have thrown a combined no-hitter against the Yankees,baseball
569,"Name a past or present, name a “professional hitter.”",baseball
570,I don’t value combined no hitters as much,baseball
571,"Never, ever trade with the Tampa Bay Rays (@_bkuh_)",baseball
572,[Highlight] Hector Neris gets Aaron Judge on a ground-out to end the 8th after several questionable pitch calls from the umpire,baseball
573,"Isaac Paredes stays hot, hits his 5th HR in his last 3 games to cut the deficit to 5-4",baseball
574,"I’ve created the 2022 Red Sox and Yankees full roster in ebaseball22, a Japanese baseball game.",baseball
575,Cristian Javier against the New York Yankees 7.0 IP 13 Ks 0 H 1 BB 0 ER 115 pitches,baseball
576,"New York’s #1 Most Wanted, Jose Altuve, hits a bomb to LF to extend the lead 2-0",baseball
577,[Highlight] Jose Altuve demolishes a solo shot to deep left field and doubles the Astros lead,baseball
578,The Yankees are 71 games into the season and 22% of their losses have come at the hands of the Orioles,baseball
579,"Cristian Javier Final Line: 7 IP, 0 ER, 0 H, 1 BB, 13 K (115 Pitches)",baseball
580,[Highlight] J.J Matijevic turns on a Gerrit Cole 100 mph fastball,baseball
581,"Is being a ""fly ball pitcher"" a bad thing?",baseball
582,Jack Suwinski makes unreal catch on top of fan in foul territory.,baseball
583,[Pittsburgh Pirates] Jack Suwinski makes an AMAZING catch to rob the Rays of a foul ball.,baseball
584,2nd place 2021 AL Rookie of the Year Wander Franco is expected to return to the lineup tomorrow after over a month on the IL.,baseball
585,"Do you think that television and radio have been good or bad for baseball, as a whole?",baseball
586,No-H****r Alert - Javier (Astros) vs. Yankees,baseball
587,The Astros should have a perfect game going if Donaldson check swing was correctly called,baseball
588,"Last year, Orioles relievers had -8.0 WAR (28th). This year, 4.7 WAR (1st, by far).",baseball
589,Jack Suwinski hits a moonshot off the back wall at Tropicana Field to put the Pirates up 5-3,baseball
590,How does baseball analytics affect your viewing experience?,baseball
591,[Jared Carrabis] Daniel Bard turns 37 today. His teammates left a wheelchair at his locker and a note on the seat that had the phone numbers for AARP and Life Alert.,baseball
592,Does your organization call players up too early or too late?,baseball
593,[highlight] Angel Hernandez called Brett Phillips “safe” at 1B. Replay quickly overturned the call,baseball
594,"[OC] Ohtani Grade Summary 6/22/22. Also, I'm now taking requests.",baseball
595,[OC] Ohtani Grade Summary 6/22/22. I'm taking requests... Top 3 upvoted games in the comments (mention the starting pitcher and game since 2016).,baseball
596,[OC] Ohtani Grade Summary 6/22/22. I'm taking requests... Top 3 upvoted games in the comments (mention the starting pitcher and game since 2016).,baseball
597,What’s your favorite baseball video game? What is your favorite feature of that game?,baseball
598,r/baseball has hit 2 million members!,baseball
599,Does anyone know if bullpen pitchers get tested before games e.g. grip strength to see if a pitcher needs a rest day or good to go?,baseball
600,"In your opinion, who had the sweetest right-handed swing in baseball history?",baseball
601,Today's game with the largest playoff implications: BOS @ CLE,baseball
602,"Thank You To All 2,000,000 Million Subscribers!",baseball
603,[Home Run Productions] The Tigers' Offense is Historically Bad in 2022,baseball
604,Who was a player than was on a Hall of Fall trajectory before he fell of a cliff?,baseball
605,Just unearthed this gem in my parent’s attic. Coincidence? I think not!,baseball
606,[Jolly Olive] Hideki Matsui is Better Than You Remember,baseball
607,"[Nathan Ruiz] The Orioles are now 23-0 when leading after six, 25-1 when leading after seven and 27-0 when leading after eight. Brandon Hyde on the bullpen: ""You obviously have a lot of confidence because the majority of time you hand them the ball, they're getting the job done.""",baseball
608,Rolando Paulino still trying to shake Danny Almonte Little League scandal,baseball
609,What teams are the best fits for Andrew Benintendi?,baseball
610,Why do almost all teams have losing records against &gt;500 teams?,baseball
611,"When MLB bans the shift next year, how exactly are they going to enforce it?",baseball
612,Quick Stathead Question,baseball
613,"Quick, dumb question. Please don't upvote.",baseball
614,Out of current rostered players. Who’s your top 10 3rd baseman?,baseball
615,Question about Pennsylvania Oil Field Worker who about 10 years ago was given a professional contract after throwing 97mph at the MLB Scouting Bureau's Open Tryouts,baseball
616,Why doesn't Walter Johnson get any love in the GOAT discussion?,baseball
617,Alek Manoah and Sandy Alcantaras savant pages are insane,baseball
618,Beautiful moments in baseball.,baseball
619,"[Mark Appel] Today, I get to play a game I love as a Major League Baseball player. LET’S GOOOOO PHILLIES!!!!",baseball
620,Mark Appel to make his Major League Debut,baseball
621,[UmpScorecards] MLB Umpire Scorecards for 6/24/2022,baseball
622,"Albert Pujols heart is with the Cardinals and is retiring with them, I want to see Freddie Freeman go back to where his heart belongs and retire with the Braves when the time comes",baseball
623,"Top 5 Plays by Win Probability Added - June 24, 2022",baseball
624,"Mark Appel on Twitter: Today, I get to play a game I love as a Major League Baseball player. LET’S GOOOOO @PHILLIES!!!!",baseball
625,[Boston Strong] Trying to flex on Rafael Devers? Big mistake.,baseball
626,{Strong} Trying to flex on Rafael Devers? Big mistake,baseball
627,{Boston Strong on Twitter} Trying to flex on Rafael Devers? Big mistake,baseball
628,Anyone know who’s signature this may be?,baseball
629,"[MattKremnitzer] If the Orioles (12-9 in June) win 2 of their next 5 games, they will claim their first full winning month since August 2017. It's been almost 5 years!!!!",baseball
630,HELP US!,baseball
631,I’m Jessica new on here,baseball
632,"Joey Votto with one of the more audible expletives of the season last night, right after a fan yells ""Jesus loves you""",baseball
633,Nightly Pick 'em Game for June 25th,baseball
634,What is 1 position that you need a better player of on your team?,baseball
635,Visiting teams were 12-3 yesterday,baseball
636,Early Baseball - European Federation Cup - Final,baseball
637,[NPB] Yoshihiro Maru chasing a duck balloon on the outfield.,baseball
638,"6/24 Highlight Roundup: FastCast, top plays, recaps/condensed games and longest dongs of the day",baseball
639,"Dear Milwaukee, I love your pitching camera angle, but please zoom in. As interesting as the second base umpire is, I would prefer seeing the players better.",baseball
640,"Cherry-picked stat: after last night's performance, Kyle Hendricks has the most scoreless outings of at least 7.1 IP (two times this season - tied with Justin Verlander, Aaron Nola and Sandy Alcantara). Kyle Hendricks also has the most outings with less than 5IP and at least 6ER.",baseball
641,[General Discussion] Around the Horn - 6/25/22,baseball
642,Front/back door (pitch) is a term that bugs me. What overused word/phrase irritates you during a broadcast?,baseball
643,3 Reasons why Aaron Judge won’t be with the New York Yankees next season,baseball
644,Zheng Guoen's Road to Fame for Academic Fraud,baseball
645,This person has the biggest penis in the world,baseball
646,Is there a place to get Game Notes when a team’s press box does not post them?,baseball
647,[Jomboy] PABLO SANDOVAL HIT STICK,baseball
648,As a Mets fan we have Guillorme. Who is the guy on your team that most dont know about but crushes it every time they get to play?,baseball
649,Stay classy Astros fans!,baseball
650,Mike Trout is a guy with superhuman powers who plays just good enough to still seem believable. Change my mind.,baseball
651,What do you call an outing where a starter goes 8 IP (or all but one IP) and the closer gets the save/win?,baseball
652,"ok, so I need help to fill this out and I guess I'm not enough of a baseball fan to know. can you guys help???",baseball
653,"[Kramer] Ty France says he has a Grade 2 flexor strain in his forearm/elbow area and is headed to the 10-day injured list. But he’s optimistic that with rest and treatment, he won’t be out for an extended period.",baseball
654,Phillies calling up former 1st overall pick Mark Appel,baseball
655,Eugenio Suarez makes an incredible stop and throw from across the diamond to prevent the go-ahead runner from reaching in the bottom of the 9th!,baseball
656,Paging stat nerds,baseball
657,Players with interesting careers after retiring?,baseball
658,The Mariners win four in a row for the first time since April 26th. Tied for their longest win streak of the year.,baseball
659,Why did Freeman sign with LA?,baseball
660,[Gelb] Phillies put Connor Brogdon on the Covid IL. They are calling up Mark Appel.,baseball
661,More Blackout BS + Apple TV coverage,baseball
662,"Freeman was a few feet from the dais, ready to take questions during a pre-game press conference, when he became overwhelmed and walked out of the room.",baseball
663,"Some random, funny, and great facts about the immortal Heinrich Ludwig 'Lou' Gehrig (1903-1941)",baseball
664,[Acee] First time in modern history (since 1900) that an MLB player has driven in the only run of a game off his brother. Austin Nola’s RBI single off Aaron Nola in the sixth inning gives Padres a 1-0 victory over the Phillies.,baseball
665,"Reds rookie Graham Ashcraft vs the Giants: 8 IP, 6 H, 2 ER, 8 K, 104 pitches",baseball
666,"The Detroit Tigers, in what is clearly the biggest news story of the day, hit their first Grand Slam of the season en route to a 5-1 victory in Arizona. Baez extends his hit streak to 8 games.",baseball
667,"[Knockahoma] Since debuting on May 28, Michael Harris II is a top 10 player in MLB by fWAR. He is the youngest player in MLB.",baseball
668,Scorecard Question,baseball
669,New stadium concept,baseball
670,Wasted Career of Mike Trout,baseball
671,"Mariners finally figure out Mike Trout, hold him to just an RBI triple to make it a 4-2 game",baseball
672,Would you pay a subscription to have viewing access to your team’s entire history of recorded games and being able to watch any game at anytime?,baseball
673,Austin Nola with an RBI against his brother Aaron Nola - Padres lead 1-0 v. the Phillies,baseball
674,Who is the WORST 2 sport athlete?,baseball
675,Javy Baez tosses the bat and chirps at a heckler.,baseball
676,Link in bio,baseball
677,"Following a Back-to-Back Shutouts, The Baltimore Orioles 1-Hit the White Sox with the Bullpen pitching 6 perfect innings to win 1-0",baseball
678,[Kubatko] The #orioles (33-39) have won three games in a row for the first time since May 8-10 and are six below .500 for the first time since May 14. Their 33rd win last season came on July 24,baseball
679,The Baltimore Orioles have given up just 1 run in their past 27 innings.,baseball
680,Kyle Hendricks Final Line Tonight: 7.1 IP 5H 0R 0BB 1K,baseball
681,Fish Man Good: Mike Trout Hits 22nd HR of 2022,baseball
682,"[Angels PR] Mike Trout has hit his 53rd career home run against the Mariners. He is now the all-time leader in career homers vs. Seattle, breaking Rafael Palmeiro’s previous record of 52.",baseball
683,Fish Man Good: Mike Trout Hits 22nd HR of 2022,baseball
684,Mike Trout just hit his 53rd career home run against the Mariners which is the most all time against them. 6 HR in his last 6 games against the Mariners for Trout.,baseball
685,With his 53rd career home run against the Mariners no player has ever hit more home runs against the Mariners than Mike Trout,baseball
686,"Baltimore Orioles bullpen tonight: 6.0 IP, 0H, 0ER, 0BB, 5K",baseball
687,[Koch] Red Sox are 40-31. Boston is the third team in the American League and the ninth team in #MLB to 40 wins. Comes despite a rancid 10-19 start. Strong comeback as we enter the first summer weekend of 2022,baseball
