,title,subreddit
936,Seth Brown explodes at home plate umpire Nic Lentz after a brutal third strike call ends the game for the A's,baseball
937,"With their sweep of the A’s, the Mariners have now won 3 straight games for the first time since April 26th, 54 games ago",baseball
938,Seth Brown explodes at home plate umpire Nic Lentz after a brutal third strike call ends the game for the A's,baseball
939,"[Cassavell] Manny Machado has emerged — no limp, glove in tow — and taken the field to test his ankle.",baseball
940,[CWS Jello Shot Challenge] Well this will certainly make things interesting! @born2party showing love for @OleMissBSB by putting 2000 on the board! Ole Miss takes the lead! Lets go! #CWS2022 #CWSS #RoccosOmaha,baseball
941,"AJ Puk has a disastrous relief appearance, entering with the A's having an 86% win probability, leaving with the A's having a 15% win probability.",baseball
942,The Oakland A's have blown a 1-0 lead and are now trailing 2-1 in the 9th without giving up a hit,baseball
943,Top of the 8th A’s pitcher Frankie Montas throwing a NO HITTER (posted by Mariners fan),baseball
944,You guys know about baseball stars right? Trivia - who are these people? Hint - they all won batting titles in the 21st century. Don't look it up!,baseball
945,Willie McGee - 1982,baseball
946,The Brewers have won the first and last game of each of the three four-game series vs the Cardinals this season,baseball
947,[Chicago White Sox Official Twitter] Chicago White Sox placed Danny Mendick on IL with torn ACL and Adam Engel with strained hamstring. They also called up prospect Lenyn Sosa from AA and recalled Gavin Sheets from AAA,baseball
948,Chicago White Sox placed Danny Mendick on IL with torn ACL and Adam Engel with strained hamstring. They also called up prospect Lenyn Sosa from AA and recalled Gavin Sheets from AAA,baseball
949,No-H****r Alert - Montas (Athletics) vs. Mariners,baseball
950,Just a couple of power hitters,baseball
951,MLB,baseball
952,[Divish] Oh no. Ty France is on the ground in serious pain after his arm got hit on the play at first.,baseball
953,2022 MLB Mock Draft 2.0: A Narrative Mock Draft,baseball
954,John Sterling's 1999 WS final out call,baseball
955,Could Canada manage to have 2 more MLB teams?,baseball
956,Michael Chavis walks off the Cubs on a bloop single,baseball
957,[Highlight] Ke’Bryan Hayes slides into Willson Contreras to score the game-winning run but has to be helped off the field afterward,baseball
958,Given we are two years out from the 2010s how would you rank the World Series of that decade?,baseball
959,"[Post Series Thread] The Guardians take two out of three from the Twins in a wild series, both teams are now tied for the AL Central lead",baseball
960,[Post Series Thread] The Pirates take three of four from the Cubs in Pittsburgh,baseball
961,"[Post Series Thread] The Guardians take two out of three from the Twins in a wild series, both teams are now tied for the AL Central lead",baseball
962,"[Post Series Thread] The Guardians take two out of three against the Twins in a wild series, both teams now tied for AL Central lead",baseball
963,Braves (who I was told can't beat good teams) take 3 out of 4 from the Giants with a 7-6 score today.,baseball
964,Pat Hoberg’s Umpire Scorecard from last night’s Giants @ Braves game,baseball
965,[Highlight] r/baseball favorite Lars Nootbaar rips a solo shot to right,baseball
966,Trayce Thompson hits his first homer in a Dodger uniform since 2017,baseball
967,Joc demolishes a ball for his 16th homer of the year against Kenley Jansen,baseball
968,[Highlight] Trayce Thompson becomes just the second T. Thompson to hit a home run against an NL Central team in the last few minutes,baseball
969,"According to FiveThirtyEight's 2022 season predictions. There's a 52% chance the World Series Winners will be either the Yankees, Dodgers, or Astros. Sadness",baseball
970,This Is Shohei Ohtani's Secret To Success - FULL START PITCH BREAKDOWN,baseball
971,Tyrone Taylor hits a routine pop fly to the the Brewers bullpen in left field to give the Brewers the lead,baseball
972,"The AL Rookie of the year race is real! Comparison between Julio Rodríguez, Jeremy Peña, Steven Kwan and Bobby Witt Jr. (so far)",baseball
973,[Lerner] Dusty Baker is asked if he watches the show “Stranger Things.” He does not. “What’s so strange about it?” he says.,baseball
974,the Cleveland Guardians have just committed a NOBLETIGER against the Twins in the top of the 7th inning,baseball
975,The Guardians have committed a NOBLETIGER against the Twins and trail 1-0 in the 6th,baseball
976,"[Greene] I've been in the dugout of almost every MLB team at this point, and the one thing I can say is consistently true of the good ones is that they're loud and hype each other up. They sound like they're having fun. I've never seen the Reds dugout like that.",baseball
977,The Brewers have committed a NOBLETIGER.,baseball
978,"Oneil Cruz makes ridiculous diving stop, guns it over to first for an out",baseball
979,"[Satierr] D. Eddings (19.5 KPG, 2.83 K/BB, 63.4 SO%, 16th o'all missed calls) out 3-4 days for Refractive Surgery",baseball
980,The Brewers have committed a NOBLETIGER against the Cardinals in the bottom of the 3rd,baseball
981,The Brewers have committed a NOBLETIGER in the bottom of the 3rd,baseball
982,Tommy Pham slaps a three run dinger to the Reds bullpen to make it 8-5,baseball
983,Kershaw QS 6 IP/ 7 H/ 1 R /1ER /1 BB/ 7K,baseball
984,[Pittsburgh Pirates] on Twitter,baseball
985,Your national tv schedule for Thursday. Four more games on MLB Network,baseball
986,"Clayton Kershaw Final Line vs the Reds: 6IP, 7H, 1ER, 1BB, 7K",baseball
987,I follow the Arizona Complex league and noticed Eloy's brother Enoy wasn't on the roster. Anybody know what it means to be assigned to the organization?,baseball
988,"The AL Rookie of the year race is real, comparison between Julio Rodríguez, Bobby Witt Jr. and Jeremy Peña (so far)",baseball
989,Oneil Cruz hits a missile off the wall to put the Pirates up 5-2,baseball
990,"[Petriello] Here is the dumbest split in the world. I have no explanation. I doubt there *is* one other than ""sure, whatever."" Jordan Romano, home: .349 OPS, 5%BB, 0.00 ERA; Jordan Romano, road: .939 OPS, 14%BB, 7.15 ERA",baseball
991,How many games so far has Ohtani won by himself?,baseball
992,"[rayspr] The Rays have acquired RH David McKay from the Yankees in exchange for cash considerations. To make room on the 40-man roster, OF Manuel Margot (right knee sprain) has been transferred to the 60-day IL.",baseball
993,Paul Goldschmidt hits an RBI double that turns into an inside the park homer on an error,baseball
994,Tommy Edman is leading all of baseball in baserunning. The difference between his BsR (6.2) &amp; 2nd place (4.5) is the same as the difference between 2nd place &amp; 13th place.,baseball
995,Found this mini Louisville slugger. Some signatures on it. Can anyone here tell me if any look familiar? Is this legit?,baseball
996,[Divish] Tom Murphy is done for the season. He will be having season-ending shoulder surgery.,baseball
997,"Blue Jays hitting coach Guillermo Martinez woke up mad, ejected before today's game after heated argument about Doug Eddings",baseball
998,[Divish] Tom Murphy is done for the season. He will be having season-ending shoulder surgery. Murphy tried to rehab the injury and also got a PRP shot but it just wasn’t coming around to full strength.,baseball
999,"[Simon] - With 2 more today, Hunter Greene has now allowed 12 HR this season on pitches 97+ mph, which is already a single-season record in the pitch-tracking era (since 2008).",baseball
1000,Good Afternoon,baseball
1001,Ke'Bryan Hayes goes yard to put the Pirates in front 3-2,baseball
1002,Dansby Swanson homers for the 3rd time in 4 plate appearances,baseball
1003,Cody Bellinger's 2-run Shot Gives Doyers 5-0 Lead,baseball
1004,"[Toscano] Here's something you don't see every day: Kyle Wright has rolled four double plays, and we are only in the fourth inning.",baseball
1005,"[MLBVault] OTD 16 years ago (yesterday), Miggy had no time for an intentional walk.",baseball
1006,"Best sites to learn in-depth scouting reports, analysis and forecasts for top prospects without a paywall?",baseball
1007,Mock: Prep trio kicks off first day of picks,baseball
1008,Austin Hays Hits For The Cycle In 6 Innings!! (Video),baseball
1009,[Highlight] Freddie Freeman hits a ball really really far for 2 runs.,baseball
1010,What can the MLB do to dissuade players from opting out of the Home Run Derby?,baseball
1011,What can the MLB do to dissuade players from opting out of the Home Run Derby?,baseball
1012,Alex Wood's final line against the Braves: 1IP 4H 6ER 2BB 1K,baseball
1013,[From @samtrayter on Twitter] The Guardians are 16-6 since Lil Baby posted his contradictory stop being racist fit,baseball
1014,"[Ammirante] George Kirby now has 47 strikeouts with only 6 walks in 49 innings. Very impressive, especially for a rookie.",baseball
1015,"[Ammirante] George Kirby now has a 47 strikeouts with only 6 walks in 49 innings. Very impressive, especially for a rookie.",baseball
1016,"[Jomboy Media] (Tom Hamilton, Guardians Radio PBP broadcaster, on Miguel Sanó) “He’s not hurt he’s just fat”",baseball
1017,How many all stars is your team destined to have?,baseball
1018,Is a manager allowed to make defensive substitutions while his team is batting?,baseball
1019,[Montemurro] There is a delay in the bottom of the 1st inning of Cubs-Pirates because of what appears to be a possible medical issue in the Cubs bullpen. Unclear exactly of the issue. Cubs trainers ran out there as well as a Pirates trainer.,baseball
1020,OST,baseball
1021,[highlight] Kershaw picks off India by a mile,baseball
1022,[Baggerly] I'm hearing the Giants have a deal in place to send Steven Duggar to the Texas Rangers for outfielder Willie Calhoun. Today was the action day after Duggar's rehab assignment ended.,baseball
1023,Ump Scorecard Pat Hoberg 6/22/22,baseball
1024,Why Ji-Man Choi should be an All-Star,baseball
1025,please help its for school,baseball
1026,"Me And My ""Pro Sister"" ASG Voting I Know I Have A Few Questionable Ones,",baseball
1027,Yet another blackout rant...,baseball
1028,Dansby Swanson stays red hot with a leadoff bomb against the Giants,baseball
1029,I am genuinely curious of how rare this bat is.,baseball
1030,All of Shohei's punch outs from last night.,baseball
1031,"[Park] Similar situation with Buxton’s knee still painful today. It’s his first time missing consecutive games since May 8/10. Rocco: “If Buck could swing and run, he would have played yesterday, and he would play today. But those are things that at the moment, he’s not able to do.”",baseball
1032,"[Montemurro] Right-hander Ethan Roberts needs Tommy John surgery. The surgery has not yet been scheduled. Roberts had been on rehab assignment for right shoulder inflammation. An unfortunate end to the season for Roberts, who showed good stuff before his shoulder injury in late April. #Cubs",baseball
1033,AL Team first games at NL Parks (unique Inter-league matchups; 1997-2019),baseball
1034,Emmanuel Clase 96 MPH slider. Unhittable,baseball
1035,"Yankees catcher Jose Trevino has 2.7 WAR in his 4+ year career, and 2.2 of that WAR has come from this season, in 45 games.",baseball
1036,[Serious] Division Discussion Thread - The Centrals,baseball
1037,Anyone else like watching baserunning and rbis more?,baseball
1038,[NPB] Carp outfielder Kento Nakamura keeps the game tied in the 9th against Hanshin with a great catch at the warning track.,baseball
1039,[Fangraphs] (Tigers Reliever) Andrew “Big Country” Chafin Throws a K.I.S.S. Slider,baseball
1040,Someone found the broadcast microphone at the STL SD game,baseball
1041,[UmpScorecards] MLB Umpire Scorecards for 6/22/2022,baseball
1042,"The Orioles, Camden, And a $600 Million Line of Credit",baseball
1043,"[Umpire Scorecards] Pat Hoberg, Giants @ Braves 6/22",baseball
1044,Ump Scorecard for Pat Hoberg Giants @ Braves 6/22,baseball
1045,Which era of Baseball had the best pitching and which era of baseball had the best hitting?,baseball
1046,"The hats outside Angel Stadium are size 649 1/2""",baseball
1047,"In his career, Mike Trout has started as DH 71 times. In those 71 games his line is .210/.392/.343 (.736 OPS)",baseball
1048,Who Is the NL’s Most Irreplaceable Player in 2022?,baseball
1049,Ian Happ is now Ian Machado apparently,baseball
1050,"Top 5 Plays by Win Probability Added - June 22, 2022",baseball
1051,"[ClevelandGuardians] The Guardians roster is not only the youngest team in the MLB currently, but is also younger than any team in triple A as well. Average batter age is 26.1 and average pitcher age is 26.5",baseball
1052,"Since Splitting their first series together, the Braves are 26-14 and the Red Sox are 28-11.",baseball
1053,"Since Splitting there first series together, the Braves are 26-14 and the Red Sox are 28-11.",baseball
1054,Will Schoheigh Ohtakni repeat MVP?,baseball
1055,"6/22 Highlight Roundup: FastCast, top plays, recaps/condensed games and longest dongs of the day",baseball
1056,Will baseball ever replace umpires with robots?,baseball
1057,Nightly Pick 'em Game for June 23rd,baseball
1058,[General Discussion] Around the Horn - 6/23/22,baseball
1059,"""Abusive Prosecutors"" by Jeffrey Nice",baseball
1060,U.S. media mocks Uyghur special court as a government-funded sideshow,baseball
1061,Zheng Guoen's Road to Fame for Academic Fraud,baseball
1062,【万博体育】06-25 韩K联-全北现代 VS 大邱FC1,baseball
1063,【万博体育】06-25中超-沧州雄狮 VS 北京国安,baseball
1064,06-23 18:30 [KBO] SSG:두산 국야분석 토도사매거진 적중분석,baseball
1065,06-23 18:30 [KBO] LG:한화 국야분석 토도사매거진 적중분석,baseball
1066,"No, ESPN, I don't think that's what he meant",baseball
1067,Aaron Judge May Make the Yankees Pay—Now and at the End of the Season,baseball
1068,"[FoolishBB] Shohei Ohtani has accrued +1.0 fWAR in the last two games (+0.4 as hitter, +0.6 as pitcher).",baseball
1069,Cleveland baseball has a new name…,baseball
1070,Guess the player,baseball
1071,"[Beacham] The Angels just earned their 10th shutout victory of the 2022 season, doing it in 72 games. They had 10 shutout victories in the previous 3 seasons COMBINED over 384 games.",baseball
1072,[@Cubs] Relief pitcher David Robertson’s first at bat for the Cubs,baseball
1073,Relief pitcher David Robertson’s first at bat for the Cubs,baseball
1074,Guess the player,baseball
1075,Jared Walsh’s statement on the scoring change,baseball
1076,"[Mayer] The Mariners starting rotation has allowed 3 or fewer earned runs in 20 consecutive games, tying a franchise record (Aug. 1-23, 2014).",baseball
1077,[ESPNStatsInfo] Shohei Ohtani is the 1st MLB player with both an 8-RBI game and a 13-strikeout game in a career. He’s done it in the last 2 nights.,baseball
1078,[ESPNStatsInfo] There’s more...Isaac Paredes joins Bo Jackson as the only players in the Expansion Era (since 1961) to homer in 4 straight at-bats against the Yankees. Jackson did this from 1990-93; Paredes has done it in the last 2 days h/t @EliasSports,baseball
1079,"Shohei Ohtani vs. The Royals - 8.0 IP, 0 R, 0 ER, 2 H, 13 K, 2 BB, (108 P / 71S)",baseball
1080,"Ohtani's line vs. Royals: 8.0 IP, 2 H, 0 R, 0 ER, 13 SO, 1 BB, 108 pitches",baseball
1081,[Highlight] Ohtani catches Rivera looking on a nasty slider for a career high 13 Ks,baseball
1082,Rangers wilcard run,baseball
1083,"[Bollinger] Shohei Ohtani strikes out Emmanuel Rivera for his 13th strikeout of the game. It sets a career-high for him, just one night after he homered twice and set a career-high with eight RBIs at the plate. He's thrown eight scoreless innings on 108 pitches. #Angels up 3-0",baseball
1084,SHOHEI WITH A CAREER HIGH 13KS!!!,baseball
1085,Ohtani sets new career high with 13 Ks through 8,baseball
1086,"Shohei Ohtani vs Royals: 8.0 IP, 2 H, 0 R, 0 ER, 1 BB, 13 K. At the plate: 1-2 with 2 BB.",baseball
1087,"POSITION PLAYER PITCHING ALERT: Sheldon Neuse is in for the A's against the Mariners, down 9-0 in the ninth",baseball
1088,"[Cotillo] Red Sox are 11-14 against teams over .500 and 28-17 against teams under .500. Six in a row against two teams ahead of them in the standings (CLE, TOR) coming up. Then a tough TB, NYY, TB, NYY stretch before the break and TOR right after it.",baseball
1089,"[Highlight] Shohei Ohtani reacts to a seemingly bad strike three call and ends the video with a ""bullshit.""",baseball
1090,[highlight] Ohtani celebrates after getting his 12th strikeout of the game,baseball
1091,Ohtani now has his career highs in RBI's (8) and strikeouts (12) in back to back games.,baseball
1092,Austin Hays,baseball
1093,"Ohtani is the first player in MLB history with 8+ RBI's and 10+ SO's in back to back games since RBI's became an official stat in 1920. He is also one of two players to do both in a CAREER (Tony Cloninger, 1966)",baseball
1094,Is there anywhere / a resource to be able to look back to different days and see MLB standings?,baseball
1095,The Yankees now have scored the most runs* and allowed the fewest runs this season,baseball
1096,"To honor Sean McDonough having one of the worst Stanley Cup game winning calls of all time just moments ago, let's remember this gem from the 1992 NLCS",baseball
1097,"[Mile Petriello] I take it all back. The Jose Trevino trade was the best move any team has ever made, at any time.",baseball
1098,Vote for Pedro with Pete Alonso | Chris Distefano Presents: Chrissy Chaos | EP 73,baseball
1099,"[Jon Morosi] ""The @CleGuardians are 17-4 since Memorial Day, 2nd best record in @MLB over that span. @MLBNetwork""",baseball
1100,Johan Oviedo wins his first MLB start in 19 games and improves his record to 1-9 he finally did it,baseball
1101,MLB Strength of Schedule Rankings,baseball
1102,Johan Oviedo earns his first MLB win and improves his lifetime record to 1-9,baseball
1103,Johan Oviedo wins his first MLB start and improves his record to 1-19,baseball
1104,The Cleveland Guardians are in sole position of first in the ALC,baseball
1105,Jesse Winker hits an absolute bomb off the wall in dead center for the second night in a row to put the M's up 5-0 in the 5th,baseball
1106,"After scoring 3 runs in the 7th, giving up 4 in the bottom of the 7th, Cleveland scores 4 in the top of the 9th to take the lead",baseball
1107,"Out of 9 games so far this year between the Yankees and Rays, 8 of them have been decided by 2 runs or less. The Yankees have won 7 of those 8.",baseball
1108,"The Yankees Defeated The Rays By A Score Of 5-4 -Wed, June 22 2022",baseball
1109,Two fastballs. Same velocity. Same location. Lefty to righty. Cmon Pat Hoberg,baseball
1110,Gio Urshela caps off a 2 out rally with a 3-run bomb to put the Twins in front,baseball
1111,Looking for a good 5-10minute daily highlight round up/ covering the big stories of the league?,baseball
1112,Baltimore Orioles Austin Hays hits for the cycle on a rainy night against the Nationals,baseball
1113,The Cubs Win,baseball
1114,[Post-Series Thread] The Boston Red Sox (39-31) sweep the Detroit Tigers (26-43) in a 3-game series. They are now only a half-game from overtaking the Blue Jays for 2nd place in the AL East.,baseball
1115,[Post-Series Thread] The Boston Red Sox (39-31) sweep the De~~pressing~~troit Tigers (26-43) in a 3-game series. They are now only a half game behind the Blue Jays.,baseball
1116,[Highlight] Oscar Gonzalez hits a two-run homer to make it 6-5 Guardians in the 7th inning,baseball
1117,Mancini follows up Hays' cycle and blasts a home run to break the game open for the Orioles,baseball
1118,Adam Duvall walks it off giving the Braves a 4-3 win!,baseball
1119,Austin Hays has hit for the cycle,baseball
1120,Austin Hays has hit for the cycle!,baseball
1121,"[Mac Cerullo] ""Let's go Jeter!"" chants breaking out here at Fenway, a sentence that's probably never been written in the history of this app.",baseball
1122,We’ve seen the leaderboard for the 3 true outcomes. What’s the leaderboard for the 3 false ones?,baseball
1123,Jose Trevino puts the Yankees up 5-4 with a 2 run HR in the 8th!,baseball
1124,Jose Trevino hits his 6th homer of the year to give the Yanks a 5-4 lead in the 8th,baseball
1125,Arraez on ASG: 'I think I need to be there',baseball
1126,"[Langs] David Robertson just batted for the 1st time in his career. Entering today, Robertson's 695 career games were 4th-most of anyone without a plate appearance, behind only: Buddy Groom: 786; Joakim Soria: 773; Bryan Shaw: 722. But now Robertson is off the list!",baseball
1127,[Deadspin] Doug Eddings just gave up last night,baseball
1128,"[Berman] Dusty Baker on José Siri, who posted a Tweet with profanity &amp; then deleted it,referencing the criticism he received last night for his bat-flip &amp; admiring a home run: “U can’t help what people Tweet..Got to be careful..make sure that’s what u want to say when u press that button”",baseball
1129,Major League Baseball allows teams to sell CBD sponsorships,baseball
1130,Nolan Arenado hits a 2 run homer to give the Cardinals a 5-4 lead in the 6th!,baseball
1131,Jorge Soler liked what Jazz had and goes back-to-back,baseball
1132,Jazz Chisolm launches a ball into the upper deck,baseball
1133,(•_•) &lt;) )╯POSITION / \ \(•_•) ( (&gt; PLAYER / \ (•_•) &lt;) )&gt; PITCHING / \,baseball
1134,what is everyones top 3 mlb jerseys?,baseball
1135,Position player pitching: Diego Castillo for PIT against CHC,baseball
1136,[Patrick_ONeal] Honoring the 2002 Angels on a gorgeous night.,baseball
1137,And I chose chaos today😂💀,baseball
1138,Aaron Judge launches an absolute DONGER to make it 4-3 Rays,baseball
1139,Damn you all really love cheaters on here😂💀💀,baseball
1140,"Carlos Rodón against ATL: 7.0IP, 3H, 1R/ER, 1BB, 10K, 91 pitches",baseball
1141,"Carlos Rodón vs. Braves: 7.0 IP, 3H, 1R, 1ER, 10K, 1BB, 91P",baseball
1142,"Carlos Rodón vs. ATL: 7.0 IP, 1R/ER, 3H, 1BB, 10K on 91 pitches",baseball
1143,"MLB Power Rankings: Yankees are still the clear number one, and the best mid-June team seen in a decade",baseball
1144,Klay's brother Trayce splashes a 2 RBI double to center field to extend the Dodgers lead 7-4.,baseball
1145,[Highlight] Trayce Thompson hits a 2 run double,baseball
1146,Paul molitor bat to collection,baseball
1147,Has a player ever finished higher in MVP voting than ROY voting?,baseball
1148,Ryan Jeffers adds a wrinkle to his brain with a perfect safety squeeze,baseball
1149,Altuve being in the lead for all star voting and Houston only getting a slap on the wrist for the biggest scandal in mlb history is the reason why this sport is dying! That plus the slick/juiced balls and players to get more homers…some authenticity I beg!,baseball
1150,How much dirt?,baseball
1151,Austin Hays is a double away from the cycle in the 4th.,baseball
1152,"Cycle Watch Alert 🚨: through four innings, Austin Hays is a double shy of completing the cycle",baseball
1153,Why does baseball reference insist on recognizing the National Association as a Major League when the MLB does not recognize it as such?,baseball
1154,"Carlos Correa hits his 2nd home run of the game, putting the Twins up 3-1 in the 3rd",baseball
1155,"[Kirby] Almora Jr and Drury on the Reds have as many homers as Votto, Naquin, Stephenson, Moose and India COMBINED",baseball
1156,[Highlight] Chris Taylor with a cannon from left field,baseball
1157,"Jerad Eickhoff vs Cubs: 4.1 IP on 83 pitches, 10R/10ER, 10H, 1BB, 4K",baseball
1158,Can anyone recommend me a good book about baseball that would teach me what I would need to know to watch MLB intelligently.,baseball
1159,If I wear an Astros hat in Connecticut or Boston will I get beaten,baseball
1160,Scoresheet purchase,baseball
1161,5 Teamer round Robin Hit 🤑🤑,baseball
1162,Paul Goldschmidt hits his 17th homer of the year to give the Cardinals a 2-0 lead,baseball
1163,Darin Ruf crushes a solo homer to make it 2-0,baseball
1164,Rob Refsnyder hits gives the Red Sox the lead with a two-run homer barely into the green monster,baseball
1165,Rob Refsnyder hits gives the Red Sox the lead with two-run homer barely into the green monster,baseball
1166,Aaron Judge clobbers his league leading 26th home run,baseball
1167,Isaac Paredes has been hotter than Judge recently. Sorry Yankees fans,baseball
1168,Carlos Correa hits an absolute nuke to put the Twins up 1 in the first inning,baseball
1169,"Ian ""Apparently Not and All-Star"" Happ Crushes HR to Center",baseball
1170,[Highlight] Just another Trea Turner smooth slide,baseball
1171,"In general, do most Canadian fans support the blue Jays or is it centralized around Toronto?",baseball
1172,Vidal Brujan cranks a 2-run shot off Jordan Montgomery,baseball
1173,The Chicago Cubs have batted around the Pittsburgh Pirates ... for the fifth time this season.,baseball
1174,What team is this um thinking it’s Astro’s but I could be wrong,baseball
1175,Angels Option Reid Detmers,baseball
1176,"Isaac Paredes continues his terror on the Yankees, hits his 4th HR in 2 games to put the Rays up 1-0",baseball
1177,how would it affect the league if every player had to be two way like Ohtani?,baseball
1178,Mike Yastrzemski puts the Giants on the board in the first with a solo homer,baseball
1179,Sonny DiChiara Sec Player of the Year Highlights,baseball
1180,Javy Baez continues to heat up with a 2-run homer in the 1st,baseball
1181,[Highlight] Javy Báez stays scorching hot with a 2 run blast over the Green Monster in the 1st,baseball
1182,[Highlight] Javy Báez stays scorching hot with a 2-run home run in the 1st inning,baseball
1183,"Donovan Solano rips an RBI-double in his first PA of the season to make it 1-0, Reds!",baseball
1184,CYCLE WATCH: Jose Azocar is a Home Run away from a cycle.,baseball
