,title,subreddit
0,Really Weird and Oddly Specific Question of the Day: Is there a player whose last name is so long that the letters on the back of his jersey forms an arc that is greater than a semi-circle?,baseball
1,Double chop guy at Braves game,baseball
2,[Foolish Baseball] What Bad Umpiring Looks Like | Baseball Bits,baseball
3,Is it possible for a player to play 38 games vs another team in a season?,baseball
4,[MLB] Your Players of the Week presented by @Chevrolet! [NL: Freddie Freeman; AL: Isaac Paredes],baseball
5,The Jacob deGrom debate,baseball
6,[Mariners Facts] Mariners batters have now been hit by 27 pitches from AL West opponents in 2022. AL West opponents have been hit by 5 pitches from Mariners pitchers in 2022.,baseball
7,The MLB top 3 players in votes for the NL AND AL,baseball
8,The Current Starters for the All-star Game,baseball
9,"[Passan] Trade! First baseman Carlos Santana is headed to the Seattle Mariners, and right-handed reliever Wyatt Mills and right-hander William Fleming, who is in A ball, will go back to the Kansas City Royals, who are sure to be active over the next five weeks. And so it begins.",baseball
10,"Send him to the HOF, now!",baseball
11,[Stephen] Michael Harris II has been worth +5 Outs Above Average in 27 games in CF. That’s a +31 pace over 162 games.,baseball
12,One MVP for each NL East Team| MLB 2022,baseball
13,Shohei Ohtani's 118 MPH 462-foot home run in ultra slow motion.,baseball
14,Shohei Ohtani's 118 MPH 462-foot home run in ultra slow motion.,baseball
15,[Stephen] MH2 has been worth +5 Outs Above Average in 27 games in CF. That’s a +31 pace over 162 games.,baseball
16,Is there any Houston hat more fitting for an All Star game hosted in LA? *,baseball
17,Minor League Hitters Swing and Miss rates by Organization,baseball
18,[MLBRosterMoves] Cardinals place OF Harrison Bader (plantar fasciitis) on the 10-day IL and RHP Jack Flaherty (shoulder strain) on the 15-day IL; select the contracts of RHP James Naile and OF Conner Capel from Triple-A Memphis,baseball
19,[Gleeman] The Twins are the only AL Central team with a winning record outside of the division.,baseball
20,[Gelb] Phillies claimed outfielder Óscar Mercado on waivers from Cleveland. He’ll go on active roster tomorrow.,baseball
21,[Heyman] Sergio Romo close to signing an MLB deal with Blue Jays,baseball
22,2022 MLB All-Star Game Cap Design Gives All 30 Teams the Gold,baseball
23,The Phillies have the best uniform set in baseball. Agree or disagree?,baseball
24,DraftKings vs FanDuel vs BetMGM vs MyBookie - 2022?,baseball
25,What is the origin story of your baseball fandom?,baseball
26,[Jeff Jones] NL All Star voting update #2,baseball
27,[Shi Davidi] AL All Star voting update #2,baseball
28,"[Passan] Trade! First baseman Carlos Santana is headed to the Seattle Mariners, and right-handed reliever Wyatt Mills and right-hander William Fleming, who is in A ball, will go back to the Kansas City Royals, who are sure to be active over the next five weeks. And so it begins.",baseball
29,Royals call up top prospect Vinnie Pasquantino,baseball
30,"[Goldberg] Royals have selected the contract of Vinnie Pasquantino. In a corresponding move, right-handed pitcher Ronald Bolaños has been designated for assignment.",baseball
31,Bro’s too good for little league,baseball
32,MLB would give Oakland A's break on fees for Las Vegas move,baseball
33,"[Mariners] Man, it’s a hot one. We’ve acquired INF Carlos Santana and cash considerations from the Royals in exchange for RHP Wyatt Mills and minor league RHP William Fleming.",baseball
34,Big box-office Astros give Yankees biggest crowds of season,baseball
35,"[Mariner Muse] JP Crawford: “I always tell them, I’ve got their back. Just know that I’ve got your back. When stuff hits the fan, I’m going to be the first one out there every time. I’m going to do that 10 times out of 10 times. I’ve always got my boys’ backs.”",baseball
36,"In honor of Raisel Iglesias tossing sunflower seeds on the field, let’s remember Phil Wellman 15 years ago",baseball
37,"[Friedman] Jhoan Duran, Absurd 100mph Splinker",baseball
38,"[Adler] In case you were wondering, Yankees pitching coach Matt Blake's contract is up after this season.",baseball
39,Nevin handled things really poorly yesterday,baseball
40,You’ve just been called up today - what is your walk up song?,baseball
41,Oakland A's Move Closer to Las Vegas Strip Deal,baseball
42,Shohei Having the Time of his Life at his First Brawl,baseball
43,'He deserved every second of it': Inside Freddie Freeman's emotional return to Atlanta,baseball
44,Want to feel old? Your favorite 2004 Red Sox player's son is playing for the Brockton Rox this summer,baseball
45,Do you think Zack Greinke should be in the Hall of Fame?,baseball
46,[Fangraphs] Power Rankings: June 13-26,baseball
47,[Sherman] MLB announces that Nationals manager Dave Martinez and Dave Roberts of the host Los Angeles Dodgers will serve as Brian Snitker's coaches for the NL All-Star team.,baseball
48,"Power rankings for this week, here is the top 10",baseball
49,2021 CF zen or 2022 CF zen,baseball
50,Blitzer?,baseball
51,[Tigers] Willie Horton has been invited by Astros manager Dusty Baker to be an honorary American League coach at the 2022 All-Star Game.,baseball
52,"Max Scherzer’s former catchers on his intensity, hilarity and The Legend of Mad Max",baseball
53,"What is your favorite ballpark that you've never been to, and why?",baseball
54,"Good morning baseball fans, here's a special clip of Ohtani-san and a Mariner having a back hug as they enjoy the sights of the game. The respect, love and admiration between these two ballclubs is notable.",baseball
55,"MLB Graphical Standings - June 27th, 2022",baseball
56,An Oral History of Max Scherzer,baseball
57,Anyone have video of the inside pitches to trout he was complaining about?,baseball
58,Any tips?,baseball
59,Chad Whitson had a near perfect performance behind the dish yesterday.,baseball
60,Lose-Lose situation: disagreeing with/refusing to hit a batter when asked by the manager?,baseball
61,Rate the pull,baseball
62,Cabrera's Hit Parade Tracker (06/27/22 Update),baseball
63,MLB Tinfoil Hat Conspiracy Theory: Oakland A's Edition,baseball
64,[UmpScorecards] MLB Umpire Scorecards for 6/26/2022,baseball
65,The Baltimore Orioles haven't lost a series since June 5th (3-0-3),baseball
66,"[Dougherty] The Angels-Mariners brawl was on the TVs when we were in their clubhouse a bit ago. Everyone was watching, of course, then we went to talk with Nelson Cruz. He smiled and asked: ""Why doesn't he like sunflower seeds?""",baseball
67,I’m announcing for a baseball tournament and I want to do some trivia. What is some super obscure baseball questions I could use for the bigger prizes?,baseball
68,"The Yankees have had 40 home games, 10 have been walk-off wins…",baseball
69,Thoughts on Cricket,baseball
70,First look at the 2022 All star caps,baseball
71,First look at the 2022 All Star Caps,baseball
72,The AL East is unfair. Again. And it has killed my love of baseball.,baseball
73,Peacock to stream Royals-Tigers game (7/3) without announcers,baseball
74,"Famed N.J. mud used to rub up baseballs could be on the way out, MLB insider reports",baseball
75,"At the start of the season, FanGraphs had NYY as the #1 rotation and PHI at #3, which was met with derision on r/baseball. Today, those two rotations are #2 and #1, respectively.",baseball
76,[Nicholson-Smith] MLB's wRC+ leaders: 1. Yordan Alvarez 198 2. Mike Trout 193 3. Paul Goldschmidt 192 4. Aaron Judge 181 5. Jose Ramirez 180 6. Rafael Devers 178 7. Bryce Harper 166 8. Alejandro Kirk 164 8. Manny Machado 164 10. J.D. Martinez 160,baseball
77,"At the start of the season, FanGraphs projected the Yankees and Phillies to have the top two rotations and was met with derision on here. Today, the two best rotations by fWAR are the Phillies and Yankees.",baseball
78,Who’s excited to catch a baseball during batting practice this week? Here’s a catch I filmed during Cubs v Cardinals BP from beginning of month.,baseball
79,"When Nature Calls, Phillies Relievers Have a Place to Go",baseball
80,State of the Baseball Subreddits 2022-06-27,baseball
81,"Dumb question, with the cop standing on the 3rd base line during the brawl, at what point does law enforcement step in?",baseball
82,"6/26 Highlight Roundup: FastCast, top plays, recaps/condensed games and longest dongs of the day",baseball
83,Nightly Pick 'em Game for June 27th,baseball
84,"José Berríos, Hyun-Jin Ryu, and Yusei Kikuchi this year for the Blue Jays: 162 IP, 100 ER, 35 HR, 5.56 ERA, -1.5 bWAR",baseball
85,Is there a good way to get a daily around the league recap without having cable?,baseball
86,[General Discussion] Around the Horn - 6/27/22,baseball
87,"Atlanta Braves super rookie ""Spencer Strider"" vs LAD",baseball
88,"RBaseball Weekly - Episode 77 - All-Star Voting - A no-no, a cycle, and a brawl",baseball
89,"Just watched the documentary ""Ballplayer:Pelotero."" I googled the two players to see what happened to them. I think one of them was arrested in Massachusetts for drug trafficking in 2018. Is this the guy?",baseball
90,"""Abusive Prosecutors"" by Jeffrey Nice",baseball
91,Who normally handles player transfers in the MLB?,baseball
92,anime,baseball
93,Since NPB has always limited extra innings this feat is all but impossible but in MLB...,baseball
94,Brawl (?),baseball
95,Mets are winning the NL. You heard it here.,baseball
96,It was “Family Day” for the Angels today,baseball
97,"Phil Nevin yells at a Mariner the night before the brawl (lip read mine), ""You. You're getting fucked tomorrow, I'm gonna fuck you motherfucker.""",baseball
98,"Rash Game Play With BAD-GIRL, MF- ZIDDIN, Vishoo. in Livik Map.",baseball
99,Phineas and Ferb explain the Dodger Stadium code of conduct,baseball
100,"Phil Nevin the night before the brawl, yelling at a Mariner (lip read mine) ""You. You're getting fucked tomorrow. I'm gonna fuck you motherfucker.""",baseball
101,WWJMD?,baseball
102,Extra Baggs: The Giants have a loyal fan base. Are they trying hard enough to grow it?,baseball
103,Need a new team to root for,baseball
104,Who’s the most obscure player you can think of?,baseball
105,Pitching line from 2020 or 2021 that had never happened before?,baseball
106,"Why are the Angles such a trash organization? Two of the best in the game on their roster. Yet, they feel the need to throw directly at batters? Seems like a culture issue.",baseball
107,Mike Trout is very good at home runs?,baseball
108,"In 1966, pitcher John Miller hit his first career home run in his first career at bat. In 1969, he hit his second career home run in what would be his last career at bat.",baseball
109,"If I was by myself, would you recommend buying a standing ticket and finding an empty ticket?",baseball
110,[Mueller]Talked w/ Upton postgame. Said when he was hit in the head last week by Lorenzen he received a number of texts from the Angels -including Trout - checking in and assuring him pitch slipped and was unintentional. But wouldn’t believe Swanson’s pitch last night was unintentional,baseball
111,"[Kyle Boddy] Per The Athletic, ex-Twins pitching coach Wes Johnson received a $750K salary to join the LSU coaching staff",baseball
112,Talked w/ Upton postgame. Said when he was hit in the head last week by Lorenzen he received a number of texts from the Angels -including Trout - checking in and assuring him pitch slipped and was unintentional. But wouldn’t believe Swanson’s pitch last night was unintentional,baseball
113,"With their win against the Braves in the 11th inning tonight, the Dodgers become the 29th team to win a 2022 extra innings game",baseball
114,Michael Harris shows off his absurd range in centerfield,baseball
115,"[Pitching Ninja] Raisel Iglesias, Knuckle Seeds (With Tail)",baseball
116,Unpopular opinion: fighting should be treated as any workforce fight would.,baseball
117,Shane McClanahan's efficiency for a K Pitcher is incredible this season,baseball
118,"Matt Olson celebrates, brushing Freddie Freeman at first, after his game-tying hit",baseball
119,Matt Olson accidentally hits Freddie Freeman on purpose after sword slashing.,baseball
120,Olson answers Freddie with a game-tying hit of his own,baseball
121,He blew the save but Kenley Jansen threw a 97.1mph cutter tonight. The last time he threw a pure cutter that hard was this pitch NLDS Game 5 2016,baseball
122,[Highlight] Freddie Freeman doubles in the 10th to score the ghost runner Trea Turner,baseball
123,Freddie gives the Dodgers the lead in the tenth inning,baseball
124,"[Lucas] Greinke acted like he was about to sign my ball... he came over grabbed the ball and looked at me and then chucked it as far as he could. I asked why he did that... he said ""for my amusement""",baseball
125,Shane McClanahan has been incredible this season,baseball
126,Braves fan doing... something as we come back from the break,baseball
127,[Highlight] Michael Harris II prevents the Dodgers from scoring the go-ahead run with a great diving catch.,baseball
128,Bennett Karoll on Twitter,baseball
129,Trayce Thompson ties the game in the 9th with a single to right,baseball
130,[Highlight] Trayce Thompson barely gets the ball over Olson’s glove to tie the game in the 9th,baseball
131,"[Nightengale] Jesse Winkler on brawl: The only thing I'm going to apologize for is flipping the fans off. That's it. As fans, they're spending their hard-earned money to come watch us play a game, and they didn't deserve that, so I apologize to the fans, especially the women and children.""",baseball
132,Can you still go to games early enough to see BP?,baseball
133,"Bellinger with an exceptionally ""tardy"" (thanks Cone) swing in the ninth inning",baseball
134,Would you rather take a 120 WAR guy that ended up being a complete jerk and was sentenced to life in prison for murder or a 75 WAR player?,baseball
135,[Hayes] Many on board the #MNTwins flight were unaware of the news that pitching coach Wes Johnson is leaving. News broke just as the team took off from Minneapolis. Team held a mandatory meeting for staff and players once they arrived at their downtown Cleveland hotel.,baseball
136,New Team,baseball
137,Who do you think is better between Ted Williams and Stan Musial?,baseball
138,"What would you prefer to have on your team, a catcher that plays elite defense, makes your whole rotation/bullpen excellent and constantly puts up around 140 wRC+ OR a shortstop that plays elite defense, makes your infield play better and constantly puts up around 160 wRC+?",baseball
139,Who do you think was better between Alex Rodriguez or Mickey Mantle?,baseball
140,"Travis d'Arnaud remains motionless, anticipating the ball hitting him or the bat.",baseball
141,D'Arnaud braces for impact as he gets plunked by Will Smith,baseball
142,[Mueller] From the moment I walked into Angels stadium this morning it was clear there was going to be a fight. Even the fans and employees were talking about it. If the umpires weren’t aware that’s absolutely ridiculous. I get tuning out the noise but context is important.,baseball
143,[Jen Mueller] From the moment I walked into Angels stadium this morning it was clear there was going to be a fight. Even the fans and employees were talking about it. If the umpires weren’t aware that’s absolutely ridiculous. I get tuning out the noise but context is important.,baseball
144,"[Stats By STATS] The @Yankees had a .123 batting average in the series with the Astros, yet still earned a split. That's the lowest batting average in a 4-game series by a team that didn't lose the series in American League history.",baseball
145,"The Yankees just finished a 13 game stretch in 13 days against the top AL contenders (minus Boston), and went 9-4",baseball
146,"If I am the Astros, I am doing whatever I can to get Willson Contreras at the deadline.",baseball
147,[Question] Safe to remove tag inside baseball glove?,baseball
148,Will Smith behind the plate making a ridiculous catch from a pitch that goes behind the batter.,baseball
149,"[Kramer]Crew chief Adrian Johnson: ""I’m not aware of the incident with Trout from last night. You’re talking about the pitch that went over his head. That was nothing for us to issue warnings today. What happened today was a guy got hit. We had warnings in. Eight guys were ejected.""",baseball
150,2022 College World Series: Ole Miss wins title vs. Oklahoma with two-game sweep in final,baseball
151,"Tony Gonsolin waves off his manager, Dave Roberts doesn't care.",baseball
152,[Mueller] Talked w/ Upton postgame. Said when he was hit in the head last week by Lorenzen he received a number of texts from the Angels -including Trout - checking in and assuring him pitch slipped and was unintentional. But wouldn’t believe Swanson’s pitch last night was unintentional,baseball
153,WaStInG TrOuT AnD OhTaNi,baseball
154,[Highlight] Spencer Strider gets out of the jam by striking out Justin Turner.,baseball
155,[Gleeman] Sources tell me and Dan Hayes that the Twins plan to promote assistant pitching coach Pete Maki to the lead pitching coach role. But fully replacing Wes Johnson will be a group effort.,baseball
156,Why do people get upset when players give game used items to celebrities and not a fan/child?,baseball
157,[BallySportsWest] Kevin’s postgame talks following the brawl,baseball
158,New To The Sport Looking For Game Suggestions,baseball
159,[Gómez] SOURCE: The #Dodgers are showing interested in potentially trading for RHP Frankie Montas and Luis Castillo.,baseball
160,"Abigail, who witnessed Joey Votto get ejected in the first inning of her first baseball game last season was at today's Mariner's game to see Jesse Winker...",baseball
161,"[Kramer] Crew chief Adrian Johnson: ""I’m not aware of the incident with Trout from last night. You’re talking about the pitch that went over his head. That was nothing for us to issue warnings today. What happened today was a guy got hit. We had warnings in. Eight guys were ejected.""",baseball
162,[Minorleaguemedia] Gunnar Henderson now has 75 AAA PA’s under his belt. 155 wRC+ .419 wOBA 1.140 OPS .207 ISO. He’s TWENTY years old,baseball
163,"[Drayer] Winker: “The only thing I apologize for is flipping the fans off. They’re spending their hard earned money to see us play a game and they didn’t deserve that so I apologize to the fans, especially the women and children.”",baseball
164,[Drayer] Just listened in on Nevin's postgame press conference. Said he has been proud of his team and how they have battled through adversity and even prouder after today. Also said twice that these things can happen when two teams face each other 8 times in 10 days.,baseball
165,"[Kramer] Julio Rodríguez on lingering tensions coming into today: ""I don't know what to tell you on that. I was just expecting to play a fun baseball game today.""",baseball
166,Alex Bregman’s baseball reference page now shows that he won Mike Trout’s fantasy football league,baseball
167,"[Justin Toscano] I’m not usually this guy, but: @GabeBurnsAJC did a really nice job of getting to Clayton Kershaw yesterday to get his thoughts on Freddie Freeman’s reception. Would’ve been nice for ESPN to recognize that, but stealing the quote works too, I guess.",baseball
168,"[Boddy] Crazy move, but for those wondering how a college team can acquire a big league coach, it probably will come as a shock for fans to realize that coach pay at a top-tier power 5 NCAA baseball program is so, so much better than professional baseball. It’s not remotely close.",baseball
169,"[Kramer] Today's crew chief, Adrian Johnson, when asked why Julio Rodríguez was ejected: ""That will be in the incident report to Major League Baseball."" Rodríguez was unsure why he was tossed since he wasn't throwing punches.",baseball
170,[PerryBurner] How can Ohtani be so nice? Even during the brawl he was trying to pull people away from fighting. 😭😭😭,baseball
171,How can Ohtani be so nice? Even during the brawl he was trying to pull people away from fighting. 😭😭😭,baseball
172,[Request] Way to stream multiple games at once?,baseball
173,[Gleeman] Per source: Sounds like the plan is for Wes Johnson to remain with the #MNTwins through the Cleveland series and then leave the team for LSU.,baseball
174,"Miguel Cabrera moves past Rod Carew for 27th on MLB's all-time hits list with No. 3,054.",baseball
175,Damn thought i was gonna see Shohei throw some bruce lee typa stuff.,baseball
176,"[Stecker] ""When people show you who they are, believe them."" - Scott Servais after the game. Gotta think that was directed at Angels interim manager Phil Nevin.",baseball
177,"[Hoch] Gleyber Torres has a mild ankle sprain, Aaron Boone said. ""I don't expect it to be serious."" #Yankees",baseball
178,"[Sarris] I have no specific knowledge about why Twins pitching coach Wes Johnson left a first place major league team for the same role at LSU, but the pay and the work/life balance are better in at the top college programs generally.",baseball
179,[Hayes] Wes Johnson is on the charter to Cleveland. MN Twins found out yesterday about the talks with LSU. Doesn’t sound like it’s known what his status is for the rest of the season.,baseball
180,I am leaking info from the Angels clubhouse about the brawl,baseball
181,"About This Afternoon: The Anaheim Angels, cowards to the core",baseball
182,[Beacham] Scott Servais &amp; Marco Gonzales both say it’s “obvious” the Angels used an opener so they could throw at the Mariners early. Servais calls it “a black eye.” Gonzales: “It shows us where they’re at. It shows us who they are.” Repeatedly called the Angels “classless.”,baseball
183,"Kyle Schwarber, June 2021: 16 HR, 0 doubles, 1.122 OPS, June 2022: 10 HR, 6 doubles, 1.069 OPS",baseball
184,"The Angels may have won the game, but they have lost everyone's respect today.",baseball
185,"[Kendall Rogers] BREAKING: @LSUbaseball is hiring @Twins pitching coach Wes Johnson as its new pitching coach, sources tell @d1baseball. Johnson has spent the last four seasons with the #Twins and marks a blockbuster hire for Jay Johnson.",baseball
186,"[OC] Summary Requests: Cole 6/25/22, Kershaw 2017WS, Arrieta 2016WS. I threw in Javier 6/25/22 as a bonus!",baseball
187,"[KendallRogers] BREAKING: @LSUbaseball is hiring @Twins pitching coach Wes Johnson as its new pitching coach, sources tell @d1baseball. Johnson has spent the last four seasons with the #Twins and marks a blockbuster hire for Jay Johnson. #LSU",baseball
188,[CHICAGOCREATURES] next to his kid 💀🫣,baseball
189,Daulton Varsho nukes a 3-run shot over the pool to extend the Diamondbacks' lead,baseball
190,I was always fascinated by these when I saw them at the stadium as a kid. I couldn’t resist picking it up for $20 despite being unable to get a signal.,baseball
191,"[SuperBarry11] Abigail is THRILLED to receive a wonderful &amp; sweet surprise!!! Thank you so much, Mr. Winker &amp; the @Mariners ❤️⚾️💙 Go Reds &amp; go Mariners!!!!! #welovebaseball l",baseball
192,[AP] Peacock to stream Royals-Tigers game without announcers,baseball
193,"Mariners fan [Sofie] orders Jesse Winker pizza, Winker replies.",baseball
194,"Fan orders Pizza for Jesse Winker, Winker replies.",baseball
195,"If Ronald Acuna Jr. or Fernando Tatis Jr. suddenly became available at the trade deadline, which of them would you trade for? If either?",baseball
196,"[Fletcher] I just realized that today’s home plate umpire, John Bacon, is a Triple-A umpire who is up as a vacation replacement. Nice game he walked into.",baseball
197,Kyle Schwarber hits a 3-run oppo taco to take the lead in the 7th,baseball
198,Luis Rengifo ties the game with a solo Home Run!,baseball
199,"Randy Arozarena with a swim move to avoid the tag on a stolen base attempt. Initially called out, overturned on replay. Rays go on to score 3 runs in the inning",baseball
200,[Post Series Thread] The Cubs (28-45) take 2 out of 3 from the Cardinals (41-34) in St. Louis.,baseball
201,Dave Sims calls out Raisel Iglesias for his behavior after the brawl,baseball
202,[Gelb] Phillies relievers have not allowed a hit to the last 42 batters they've faced. Only runner to reach was on a walk last Wednesday.,baseball
203,"Marlins Select Erik Gonzalez, Designate Willians Astudillo",baseball
204,"TIL Mike Trout has played in just 3 postseason games in his career, losing all 3 to the Royals and batting 0.83 (2014)",baseball
205,I know what we’re all thinking,baseball
206,"Iglesias continues his tirade by throwing a box of sunflower seeds on the field, for the Angels’ groundskeepers to clean up",baseball
207,[Sofie] An M's fan sent a pizza to the Seattle clubhouse for Jesse Winker following his ejection for his role in the benches-clearing brawl. He later DM'd her to thank her for the pizza (thread).,baseball
208,The Cubs beat the Cardinals 6-5 to take 2 out of 3 in St. Louis.,baseball
209,Game of the Day 6/26 ⚾ Dodgers (44-26) @ Braves (42-31) 7:08 PM ET,baseball
210,"Jackson Tetreault’s 3rd MLB Start final line against the Rangers: 6.0IP, 4H, 1R, 1ER, 2BB, 4K, W",baseball
211,"Toro enacts karmic retribution, homers after replacing JP Crawford to give the Ms the lead",baseball
212,[Highlight] Abraham Toro schedules a HBP for his next Angels game by putting the Mariners up 1-0 in the 6th with a solo shot.,baseball
213,Yankee fans go crazy for a little girl landing a bottle flip,baseball
214,[Plunkett] Dave Roberts acknowledged preliminary hopes that Betts would be back in about two weeks is not proving to be realistic.,baseball
215,Ole Miss Wins CWS vs. Oklahoma,baseball
216,[Post Series Thread] The Oakland A's (25-49) take 2 out of three in Kansas City (26-45) in this weekend's most talked-about series.,baseball
217,Olimpija - Vindija,baseball
